id,wort,wortart,formen,bedeutung,beispiel,uebersetzung,thema,lerndatum,level,quelle,source_type,tags,notes,parent_id,form_type
VOC-20260522-304,die Kasse,Substantiv,"die Kasse, -n",quầy thu ngân/quầy vé,Die Karten sollen an der Kasse abgeholt werden.,Vé phải được lấy ở quầy vé.,Einkauf,2026-05-22,B1,horen/1.72,horen,B1;DTZ;Einkauf,
VOC-20260522-305,die Nachricht,Substantiv,"die Nachricht, -en",tin nhắn/thông báo,"In der Nachricht bittet Alex Max, früher dort zu sein.",Trong tin nhắn Alex nhờ Max đến đó sớm hơn.,Alltag,2026-05-22,B1,horen/1.72,horen,B1;DTZ;Alltag,
VOC-20260522-306,bitten,Verb,bat - hat gebeten,nhờ/đề nghị,"Alex bittet Max, eine halbe Stunde vor Beginn am Kino zu sein.",Alex nhờ Max có mặt tại rạp nửa giờ trước khi bắt đầu.,Alltag,2026-05-22,B1,horen/1.72,horen,B1;DTZ;Alltag,
VOC-20260522-307,der Elternsprechtag,Substantiv,"der Elternsprechtag, -e",ngày họp phụ huynh,Der Elternsprechtag wurde am Freitag abgesagt.,Buổi họp phụ huynh đã bị hủy vào thứ Sáu.,Bildung,2026-05-22,B1,horen/1.73,horen,B1;DTZ;Bildung,
VOC-20260522-308,der Brief,Substantiv,"der Brief, -e",lá thư,Sie soll auf einen Brief mit dem neuen Termin warten.,Bà ấy nên đợi một lá thư có lịch hẹn mới.,Alltag,2026-05-22,B1,horen/1.73,horen,B1;DTZ;Alltag,
VOC-20260522-309,der Termin,Substantiv,"der Termin, -e",lịch hẹn,Sie wird einen neuen Termin schriftlich bekommen.,Bà ấy sẽ nhận được lịch hẹn mới bằng văn bản.,Alltag,2026-05-22,B1,horen/1.73,horen,B1;DTZ;Alltag,
VOC-20260522-310,schriftlich,Adjektiv,,bằng văn bản,Sie wird einen neuen Termin schriftlich bekommen.,Bà ấy sẽ nhận được lịch hẹn mới bằng văn bản.,Behörde,2026-05-22,B1,horen/1.73,horen,B1;DTZ;Behörde,
VOC-20260522-311,die Ansage,Substantiv,"die Ansage, -n",lời thông báo,"In der Ansage wird gesagt, dass die S4 von Gleis 7 abfährt.",Trong thông báo nói rằng tàu S4 khởi hành từ sân ga 7.,Verkehr,2026-05-22,B1,horen/1.74,horen,B1;DTZ;Verkehr,
VOC-20260522-312,die Linie,Substantiv,"die Linie, -n",tuyến,Die Linie S4 zum Busbahnhof fährt heute von Gleis 7.,Tuyến S4 đến bến xe buýt hôm nay chạy từ sân ga 7.,Verkehr,2026-05-22,B1,horen/1.74,horen,B1;DTZ;Verkehr,
VOC-20260522-313,angeben,Verb,gab an - hat angegeben,nêu/cho biết,"Es wird angegeben, dass die S4 heute von Gleis 7 abfährt.",Được cho biết rằng tàu S4 hôm nay khởi hành từ sân ga 7.,Allgemein,2026-05-22,B1,horen/1.74,horen,B1;DTZ;Allgemein,trennbar
VOC-20260522-314,falsch,Adjektiv,,sai,"Von Gleis 5 ist falsch, weil die S4 heute von Gleis 7 abfährt.",Từ sân ga 5 là sai vì tàu S4 hôm nay đi từ sân ga 7.,Allgemein,2026-05-22,B1,horen/1.74,horen,B1;DTZ;Allgemein,
VOC-20260522-315,das Obst,Substantiv,"das Obst, ?",trái cây,Welche Artikel sind heute bei einer Sonderaktion erhältlich? Obst.,Mặt hàng nào hôm nay có ưu đãi đặc biệt? Trái cây.,Einkauf,2026-05-22,B1,horen/1.75,horen,B1;DTZ;Einkauf,không chia số nhiều
VOC-20260522-316,die Sonderaktion,Substantiv,"die Sonderaktion, -en",đợt khuyến mãi đặc biệt,Welche Artikel sind heute bei einer Sonderaktion erhältlich?,Mặt hàng nào hôm nay có trong đợt khuyến mãi đặc biệt?,Einkauf,2026-05-22,B1,horen/1.75,horen,B1;DTZ;Einkauf,
VOC-20260522-317,erhältlich,Adjektiv,,có sẵn để mua,Welche Artikel sind heute bei einer Sonderaktion erhältlich?,Mặt hàng nào hôm nay có sẵn để mua với khuyến mãi đặc biệt?,Einkauf,2026-05-22,B1,horen/1.75,horen,B1;DTZ;Einkauf,
VOC-20260522-318,der Sonderpreis,Substantiv,"der Sonderpreis, -e",giá ưu đãi,Spanische Erdbeeren und Orangen sind zu einem Sonderpreis im Angebot.,Dâu tây và cam Tây Ban Nha có giá ưu đãi.,Einkauf,2026-05-22,B1,horen/1.75,horen,B1;DTZ;Einkauf,
VOC-20260522-319,der Artikel,Substantiv,"der Artikel, -",mặt hàng/sản phẩm,Welche Artikel sind heute bei einer Sonderaktion erhältlich?,Mặt hàng nào hôm nay có trong đợt khuyến mãi?,Einkauf,2026-05-22,B1,horen/1.75,horen,B1;DTZ;Einkauf,
VOC-20260522-320,die Kundenkarte,Substantiv,"die Kundenkarte, -n",thẻ khách hàng,Welche Möglichkeiten bietet die Kundenkarte?,Thẻ khách hàng mang lại những khả năng nào?,Einkauf,2026-05-22,B1,horen/1.76,horen,B1;DTZ;Einkauf,
VOC-20260522-321,die Barzahlung,Substantiv,"die Barzahlung, -en",thanh toán bằng tiền mặt,Sie können ohne Barzahlung einkaufen.,Bạn có thể mua sắm mà không cần thanh toán tiền mặt.,Einkauf,2026-05-22,B1,horen/1.76,horen,B1;DTZ;Einkauf,
VOC-20260522-322,bezahlen,Verb,bezahlte - hat bezahlt,thanh toán,Sie können später bezahlen.,Bạn có thể thanh toán sau.,Einkauf,2026-05-22,B1,horen/1.76,horen,B1;DTZ;Einkauf,
VOC-20260522-323,monatlich,Adjektiv,,hàng tháng,Die Einkäufe werden monatlich verrechnet.,Các giao dịch mua được thanh toán hàng tháng.,Allgemein,2026-05-22,B1,horen/1.76,horen,B1;DTZ;Allgemein,
VOC-20260522-324,verrechnen,Verb,verrechnete - hat verrechnet,thanh toán bù trừ/quyết toán,Die Einkäufe werden monatlich verrechnet.,Các giao dịch mua được quyết toán hàng tháng.,Behörde,2026-05-22,B1,horen/1.76,horen,B1;DTZ;Behörde,
VOC-20260522-325,die Agentur,Substantiv,"die Agentur, -en",cơ quan/đại lý,Agentur für Arbeit ist eine Behörde.,Cơ quan việc làm là một cơ quan hành chính.,Behörde,2026-05-22,B1,horen/1.77,horen,B1;DTZ;Behörde,
VOC-20260522-326,das Sekretariat,Substantiv,"das Sekretariat, -e",văn phòng thư ký,Frau Müller soll im Sekretariat anrufen.,Bà Müller nên gọi điện đến văn phòng thư ký.,Arbeit,2026-05-22,B1,horen/1.77,horen,B1;DTZ;Arbeit,
VOC-20260522-327,die Fortbildung,Substantiv,"die Fortbildung, -en",khóa đào tạo nâng cao,"Frau Müller wird nicht gebeten, eine Fortbildung zu machen.",Bà Müller không được yêu cầu tham gia khóa đào tạo nâng cao.,Bildung,2026-05-22,B1,horen/1.77,horen,B1;DTZ;Bildung,
VOC-20260522-328,die Schulung,Substantiv,"die Schulung, -en",khóa huấn luyện,Herr Radomir selbst ist auf einer Schulung.,Bản thân ông Radomir đang ở một khóa huấn luyện.,Bildung,2026-05-22,B1,horen/1.77,horen,B1;DTZ;Bildung,
VOC-20260522-329,halten,Verb,hielt - hat gehalten,dừng lại,Die Züge halten heute nicht am Hauptbahnhof.,Các tàu hôm nay không dừng ở ga chính.,Verkehr,2026-05-22,B1,horen/1.78,horen,B1;DTZ;Verkehr,
VOC-20260522-330,der Passagier,Substantiv,"der Passagier, -e",hành khách,Passagiere sollen mit der U-Bahn fahren.,Hành khách nên đi tàu điện ngầm.,Verkehr,2026-05-22,B1,horen/1.78,horen,B1;DTZ;Verkehr,
VOC-20260522-331,die Möglichkeit,Substantiv,"die Möglichkeit, -en",khả năng/cách,"Es gibt eine Möglichkeit, mit der U-Bahn und dem Bus zum Hauptbahnhof zu gelangen.",Có một cách để đến ga chính bằng tàu điện ngầm và xe buýt.,Allgemein,2026-05-22,B1,horen/1.78,horen,B1;DTZ;Allgemein,
VOC-20260522-332,wechseln,Verb,wechselte - hat gewechselt,đổi/chuyển,Sie sollen in den Bus 8 umsteigen.,Bạn nên chuyển sang xe buýt số 8.,Verkehr,2026-05-22,B1,horen/1.78,horen,B1;DTZ;Verkehr,ở đây dùng cụm umsteigen — đồng nghĩa wechseln
VOC-20260522-333,der Zahnarzt,Substantiv,"der Zahnarzt, -ärzte",nha sĩ,Herr Didi soll mit der Versichertenkarte zum Zahnarzt gehen.,Ông Didi nên đến nha sĩ với thẻ bảo hiểm y tế.,Gesundheit,2026-05-22,B1,horen/1.79,horen,B1;DTZ;Gesundheit,
VOC-20260522-334,vergessen,Verb,vergaß - hat vergessen,quên,Er hat die Versichertenkarte beim letzten Termin vergessen.,Anh ấy đã quên thẻ bảo hiểm y tế ở lần hẹn trước.,Alltag,2026-05-22,B1,horen/1.79,horen,B1;DTZ;Alltag,
VOC-20260522-335,die Behandlung,Substantiv,"die Behandlung, -en",việc điều trị,Es geht nicht um eine sofortige Behandlung.,Vấn đề không phải là điều trị ngay lập tức.,Gesundheit,2026-05-22,B1,horen/1.79,horen,B1;DTZ;Gesundheit,
VOC-20260522-336,ausmachen,Verb,machte aus - hat ausgemacht,sắp xếp/hẹn,Herr Didi muss keinen neuen Termin ausmachen.,Ông Didi không cần sắp xếp lịch hẹn mới.,Alltag,2026-05-22,B1,horen/1.79,horen,B1;DTZ;Alltag,trennbar
VOC-20260522-337,sofort,Adverb,,ngay lập tức,Es geht nicht um eine sofortige Behandlung.,Vấn đề không phải là điều trị ngay lập tức.,Allgemein,2026-05-22,B1,horen/1.79,horen,B1;DTZ;Allgemein,
VOC-20260522-338,der Hausarzt,Substantiv,"der Hausarzt, -ärzte",bác sĩ gia đình,Der Patient soll zum Hausarzt gehen.,Bệnh nhân nên đến bác sĩ gia đình.,Gesundheit,2026-05-22,B1,horen/1.80,horen,B1;DTZ;Gesundheit,
VOC-20260522-339,die Überweisung,Substantiv,"die Überweisung, -en",giấy giới thiệu/chuyển khoản,Eine Überweisung wird nicht benötigt.,Một giấy giới thiệu không cần thiết.,Gesundheit,2026-05-22,B1,horen/1.80,horen,B1;DTZ;Gesundheit,
VOC-20260522-340,die Blutwerte,Substantiv,die Blutwerte (Pl.),các chỉ số máu,Er soll die Blutwerte für die Anästhesie holen.,Ông ấy nên lấy các chỉ số máu cho việc gây mê.,Gesundheit,2026-05-22,B1,horen/1.80,horen,B1;DTZ;Gesundheit,thường ở số nhiều
VOC-20260522-341,der Patient,Substantiv,"der Patient, -en",bệnh nhân,Was soll der Patient tun?,Bệnh nhân nên làm gì?,Gesundheit,2026-05-22,B1,horen/1.80,horen,B1;DTZ;Gesundheit,n-Deklination
VOC-20260522-342,ausfallen,Verb,fiel aus - ist ausgefallen,bị hủy/không diễn ra,Der Kurs am Mittwoch fällt leider aus.,Tiếc là khóa học thứ Tư không diễn ra.,Bildung,2026-05-22,B1,horen/1.81,horen,B1;DTZ;Bildung,trennbar
VOC-20260522-343,krank,Adjektiv,,ốm/bệnh,Herr Müller ist krank.,Ông Müller bị ốm.,Gesundheit,2026-05-22,B1,horen/1.81,horen,B1;DTZ;Gesundheit,
VOC-20260522-344,die Büroleiterin,Substantiv,"die Büroleiterin, -nen",nữ trưởng văn phòng,"Frau Glück, die Büroleiterin, soll angerufen werden.","Bà Glück, trưởng văn phòng, cần được gọi điện.",Arbeit,2026-05-22,B1,horen/1.82,horen,B1;DTZ;Arbeit,
VOC-20260522-345,gebeten werden,Redemittel,,được nhờ/đề nghị,"Frau Müller wird gebeten, Frau Glück anzurufen.",Bà Müller được nhờ gọi điện cho bà Glück.,Alltag,2026-05-22,B1,horen/1.82,horen,B1;DTZ;Alltag,Passiv của bitten
VOC-20260522-346,angegeben,Adjektiv,,đã được nêu/cho sẵn,Sie soll Frau Glück unter der angegebenen Telefonnummer anrufen.,Bà ấy nên gọi cho bà Glück theo số điện thoại đã cho.,Alltag,2026-05-22,B1,horen/1.82,horen,B1;DTZ;Alltag,Partizip II của angeben
VOC-20260522-347,der Flughafen,Substantiv,"der Flughafen, -häfen",sân bay,"Sie planen, zum Flughafen zu gelangen.",Bạn dự định đến sân bay.,Verkehr,2026-05-22,B1,horen/1.83,horen,B1;DTZ;Verkehr,
VOC-20260522-348,deutlich,Adjektiv,,rõ ràng,"Die Ansage macht deutlich, dass die S8 von Gleis 12 abfährt.",Thông báo nêu rõ rằng tàu S8 khởi hành từ sân ga 12.,Allgemein,2026-05-22,B1,horen/1.83,horen,B1;DTZ;Allgemein,
VOC-20260522-349,benutzen,Verb,benutzte - hat benutzt,sử dụng,Welches Gleis müssen Sie benutzen?,Bạn phải sử dụng sân ga nào?,Allgemein,2026-05-22,B1,horen/1.83,horen,B1;DTZ;Allgemein,
VOC-20260522-350,die Taste,Substantiv,"die Taste, -n",phím bấm,Sie sollen die Taste 3 drücken.,Bạn nên nhấn phím số 3.,Technologie,2026-05-22,B1,horen/1.84,horen,B1;DTZ;Technologie,
VOC-20260522-351,drücken,Verb,drückte - hat gedrückt,nhấn/bấm,Die Taste 3 drücken.,Nhấn phím số 3.,Technologie,2026-05-22,B1,horen/1.84,horen,B1;DTZ;Technologie,
VOC-20260522-352,die Internetverbindung,Substantiv,"die Internetverbindung, -en",kết nối internet,Ihre Internetverbindung ist nicht aktiv.,Kết nối internet của bạn không hoạt động.,Technologie,2026-05-22,B1,horen/1.84,horen,B1;DTZ;Technologie,
VOC-20260522-353,die Rechnung,Substantiv,"die Rechnung, -en",hóa đơn,Die Taste 2 ist für Fragen zur Rechnung gedacht.,Phím số 2 dành cho các câu hỏi về hóa đơn.,Behörde,2026-05-22,B1,horen/1.84,horen,B1;DTZ;Behörde,
VOC-20260522-354,drahtlos,Adjektiv,,không dây,Die Einrichtung einer drahtlosen Internetverbindung.,Việc thiết lập kết nối internet không dây.,Technologie,2026-05-22,B1,horen/1.84,horen,B1;DTZ;Technologie,
VOC-20260522-355,reparieren,Verb,reparierte - hat repariert,sửa chữa,Das Fahrzeug ist vollständig repariert.,Chiếc xe đã được sửa chữa hoàn toàn.,Verkehr,2026-05-22,B1,horen/1.85,horen,B1;DTZ;Verkehr,
VOC-20260522-356,das Ersatzteil,Substantiv,"das Ersatzteil, -e",phụ tùng thay thế,Die Werkstatt hat sich um die Ersatzteile gekümmert.,Xưởng đã lo về phụ tùng thay thế.,Verkehr,2026-05-22,B1,horen/1.85,horen,B1;DTZ;Verkehr,
VOC-20260522-357,vollständig,Adjektiv,,hoàn toàn,Das Fahrzeug ist vollständig repariert.,Chiếc xe đã được sửa chữa hoàn toàn.,Allgemein,2026-05-22,B1,horen/1.85,horen,B1;DTZ;Allgemein,
VOC-20260522-358,sich kümmern,Verb,kümmerte sich - hat sich gekümmert,lo liệu/chăm sóc,Die Werkstatt hat sich um die Ersatzteile gekümmert.,Xưởng đã lo liệu về phụ tùng thay thế.,Alltag,2026-05-22,B1,horen/1.85,horen,B1;DTZ;Alltag,"reflexive, đi với um + Akk"
VOC-20260522-359,die Prüfung,Substantiv,"die Prüfung, -en",kỳ thi,Wann beginnt die schriftliche DTZ-Prüfung?,Khi nào kỳ thi DTZ viết bắt đầu?,Bildung,2026-05-22,B1,horen/1.86,horen,B1;DTZ;Bildung,
VOC-20260522-360,die Ankunftszeit,Substantiv,"die Ankunftszeit, -en",giờ đến,"8:30 Uhr ist die Ankunftszeit, nicht der Prüfungsbeginn.","8:30 là giờ đến, không phải giờ bắt đầu thi.",Allgemein,2026-05-22,B1,horen/1.86,horen,B1;DTZ;Allgemein,
VOC-20260522-361,beginnen,Verb,begann - hat begonnen,bắt đầu,Die schriftliche DTZ-Prüfung beginnt am Montag.,Kỳ thi DTZ viết bắt đầu vào thứ Hai.,Allgemein,2026-05-22,B1,horen/1.86,horen,B1;DTZ;Allgemein,
VOC-20260522-362,die Reparatur,Substantiv,"die Reparatur, -en",việc sửa chữa,Warum hat sich die Reparatur verzögert?,Tại sao việc sửa chữa bị chậm trễ?,Verkehr,2026-05-22,B1,horen/1.87,horen,B1;DTZ;Verkehr,
VOC-20260522-363,sich verzögern,Verb,verzögerte sich - hat sich verzögert,bị chậm trễ,Die Reparatur hat sich verzögert.,Việc sửa chữa đã bị chậm trễ.,Allgemein,2026-05-22,B1,horen/1.87,horen,B1;DTZ;Allgemein,reflexive
VOC-20260522-364,die Lieferung,Substantiv,"die Lieferung, -en",việc giao hàng,Wegen einer verspäteten Lieferung ist nicht der Grund.,Vì giao hàng chậm không phải là lý do.,Verkehr,2026-05-22,B1,horen/1.87,horen,B1;DTZ;Verkehr,
VOC-20260522-365,verspätet,Adjektiv,,muộn/trễ,Wegen einer verspäteten Lieferung ist nicht korrekt.,Vì giao hàng muộn là không chính xác.,Allgemein,2026-05-22,B1,horen/1.87,horen,B1;DTZ;Allgemein,
VOC-20260522-366,die Notwendigkeit,Substantiv,"die Notwendigkeit, -en",sự cần thiết,Wegen der Notwendigkeit mehrerer Ersatzteile.,Vì sự cần thiết của nhiều phụ tùng thay thế.,Allgemein,2026-05-22,B1,horen/1.87,horen,B1;DTZ;Allgemein,
VOC-20260522-367,abnehmen,Verb,nahm ab - hat abgenommen,nhận/tổ chức (kỳ thi),Eine Vertretung wird die Prüfung abnehmen.,Một người thay thế sẽ tổ chức kỳ thi.,Bildung,2026-05-22,B1,horen/1.88,horen,B1;DTZ;Bildung,trennbar
VOC-20260522-368,regulär,Adjektiv,,thường lệ/chính thức,Herr Schneider ist der reguläre Prüfer.,Ông Schneider là giám khảo chính thức.,Allgemein,2026-05-22,B1,horen/1.88,horen,B1;DTZ;Allgemein,
VOC-20260522-369,der Prüfer,Substantiv,"der Prüfer, -",giám khảo,"Herr Schneider, der reguläre Prüfer, ist krank.","Ông Schneider, giám khảo chính thức, bị ốm.",Bildung,2026-05-22,B1,horen/1.88,horen,B1;DTZ;Bildung,
VOC-20260522-370,durchführen,Verb,führte durch - hat durchgeführt,thực hiện/tổ chức,Eine Vertretung wird die Prüfung durchführen.,Một người thay thế sẽ tổ chức kỳ thi.,Arbeit,2026-05-22,B1,horen/1.88,horen,B1;DTZ;Arbeit,trennbar
VOC-20260522-371,der Zugriff,Substantiv,"der Zugriff, -e",quyền truy cập,Wann ist der Online-Banking-Zugriff nicht verfügbar?,Khi nào quyền truy cập ngân hàng trực tuyến không khả dụng?,Technologie,2026-05-22,B1,horen/1.89,horen,B1;DTZ;Technologie,
VOC-20260522-372,die Wartungsarbeit,Substantiv,"die Wartungsarbeit, -en",công việc bảo trì,Wegen Wartungsarbeiten ist der Zugriff nicht verfügbar.,Do công việc bảo trì nên không thể truy cập.,Technologie,2026-05-22,B1,horen/1.89,horen,B1;DTZ;Technologie,thường dùng số nhiều
VOC-20260522-373,der Vormittag,Substantiv,"der Vormittag, -e",buổi sáng,Diese Zeit fällt auf den Vormittag.,Khoảng thời gian này rơi vào buổi sáng.,Allgemein,2026-05-22,B1,horen/1.89,horen,B1;DTZ;Allgemein,
VOC-20260522-374,die Tierarztpraxis,Substantiv,"die Tierarztpraxis, -praxen",phòng khám thú y,Die Tierarztpraxis Müller sagt Termine ab.,Phòng khám thú y Müller hủy các lịch hẹn.,Gesundheit,2026-05-22,B1,horen/1.90,horen,B1;DTZ;Gesundheit,
VOC-20260522-375,die Krankenhauseinlieferung,Substantiv,"die Krankenhauseinlieferung, -en",việc nhập viện,Termine werden wegen einer Krankenhauseinlieferung abgesagt.,Các lịch hẹn bị hủy do việc nhập viện.,Gesundheit,2026-05-22,B1,horen/1.90,horen,B1;DTZ;Gesundheit,
VOC-20260522-376,einliefern,Verb,lieferte ein - hat eingeliefert,đưa vào (bệnh viện),Die Hauptärztin wurde ins Krankenhaus eingeliefert.,Bác sĩ chính đã được đưa vào bệnh viện.,Gesundheit,2026-05-22,B1,horen/1.90,horen,B1;DTZ;Gesundheit,trennbar
VOC-20260522-377,die Schwangerschaft,Substantiv,"die Schwangerschaft, -en",thai kỳ,Eine Schwangerschaft ist nicht der Grund für die Absage.,Thai kỳ không phải là lý do hủy.,Familie,2026-05-22,B1,horen/1.90,horen,B1;DTZ;Familie,
VOC-20260522-378,die Überlastung,Substantiv,"die Überlastung, -en",sự quá tải,Sie nehmen keine neuen Reparaturen wegen einer Überlastung an.,Họ không nhận sửa chữa mới do quá tải.,Arbeit,2026-05-22,B1,horen/1.91,horen,B1;DTZ;Arbeit,
VOC-20260522-379,annehmen,Verb,nahm an - hat angenommen,tiếp nhận/chấp nhận,Das Fahrradgeschäft nimmt keine neuen Reparaturen an.,Cửa hàng xe đạp không nhận sửa chữa mới.,Arbeit,2026-05-22,B1,horen/1.91,horen,B1;DTZ;Arbeit,trennbar
VOC-20260522-380,der Umzug,Substantiv,"der Umzug, -züge",việc chuyển nhà,Wegen eines Umzugs ist nicht der Grund.,Vì chuyển nhà không phải là lý do.,Wohnen,2026-05-22,B1,horen/1.91,horen,B1;DTZ;Wohnen,
VOC-20260522-381,plötzlich,Adverb,,đột ngột/bất ngờ,Es gibt plötzlich sehr viele Reparaturaufträge.,Đột nhiên có rất nhiều đơn sửa chữa.,Allgemein,2026-05-22,B1,horen/1.91,horen,B1;DTZ;Allgemein,
VOC-20260522-382,der Auftrag,Substantiv,"der Auftrag, -träge",đơn đặt hàng/nhiệm vụ,Es gibt sehr viele Reparaturaufträge.,Có rất nhiều đơn sửa chữa.,Arbeit,2026-05-22,B1,horen/1.91,horen,B1;DTZ;Arbeit,
VOC-20260522-383,annullieren,Verb,annullierte - hat annulliert,hủy bỏ,Der Zug wurde aufgrund von Gleisbauarbeiten annulliert.,Chuyến tàu đã bị hủy do công việc xây dựng đường ray.,Verkehr,2026-05-22,B1,horen/1.92,horen,B1;DTZ;Verkehr,
VOC-20260522-384,die Gleisbauarbeit,Substantiv,"die Gleisbauarbeit, -en",công việc xây dựng đường ray,Wegen Gleisbauarbeiten wurde der Zug annulliert.,Do công việc xây dựng đường ray chuyến tàu đã bị hủy.,Verkehr,2026-05-22,B1,horen/1.92,horen,B1;DTZ;Verkehr,thường dùng số nhiều
VOC-20260522-385,die Störung,Substantiv,"die Störung, -en",sự cố/gián đoạn,Keine Störung wird als Grund angegeben.,Không có sự cố nào được nêu làm lý do.,Technologie,2026-05-22,B1,horen/1.92,horen,B1;DTZ;Technologie,
VOC-20260522-386,der Unfall,Substantiv,"der Unfall, -fälle",tai nạn,Kein Unfall wird erwähnt.,Không có tai nạn nào được đề cập.,Verkehr,2026-05-22,B1,horen/1.92,horen,B1;DTZ;Verkehr,
VOC-20260522-387,die Theateraufführung,Substantiv,"die Theateraufführung, -en",buổi diễn kịch,Die Theateraufführung wird abgesagt.,Buổi diễn kịch bị hủy.,Freizeit,2026-05-22,B1,horen/1.93,horen,B1;DTZ;Freizeit,
VOC-20260522-388,die Verletzung,Substantiv,"die Verletzung, -en",vết thương/chấn thương,Wegen einer Verletzung wird die Aufführung abgesagt.,Do chấn thương nên buổi diễn bị hủy.,Gesundheit,2026-05-22,B1,horen/1.93,horen,B1;DTZ;Gesundheit,
VOC-20260522-389,sich verletzen,Verb,verletzte sich - hat sich verletzt,tự làm bị thương,Die Hauptdarstellerin hat sich verletzt.,Nữ diễn viên chính đã bị thương.,Gesundheit,2026-05-22,B1,horen/1.93,horen,B1;DTZ;Gesundheit,reflexive
VOC-20260522-390,der Streik,Substantiv,"der Streik, -s",cuộc đình công,Der Streik ist nicht der Grund für die Absage.,Cuộc đình công không phải là lý do hủy.,Arbeit,2026-05-22,B1,horen/1.93,horen,B1;DTZ;Arbeit,
VOC-20260522-391,der Feiertag,Substantiv,"der Feiertag, -e",ngày lễ,Der Feiertag ist nicht der Grund.,Ngày lễ không phải là lý do.,Freizeit,2026-05-22,B1,horen/1.93,horen,B1;DTZ;Freizeit,
VOC-20260522-392,das Fitnessstudio,Substantiv,"das Fitnessstudio, -s",phòng tập gym,Das Fitnessstudio ist geschlossen.,Phòng tập gym đã đóng cửa.,Freizeit,2026-05-22,B1,horen/1.94,horen,B1;DTZ;Freizeit,
VOC-20260522-393,schließen,Verb,schloss - hat geschlossen,đóng cửa,Wegen Renovierungsarbeiten müssen wir das Studio schließen.,Do công việc cải tạo nên chúng tôi phải đóng phòng tập.,Alltag,2026-05-22,B1,horen/1.94,horen,B1;DTZ;Alltag,
VOC-20260522-394,die Krankheit,Substantiv,"die Krankheit, -en",bệnh tật,Die Krankheit wird nur erwähnt.,Bệnh tật chỉ được đề cập.,Gesundheit,2026-05-22,B1,horen/1.94,horen,B1;DTZ;Gesundheit,
VOC-20260522-395,das Jubiläum,Substantiv,"das Jubiläum, Jubiläen",lễ kỷ niệm,Eine kleine Party zum Jubiläum.,Một bữa tiệc nhỏ nhân ngày kỷ niệm.,Freizeit,2026-05-22,B1,horen/1.94,horen,B1;DTZ;Freizeit,
VOC-20260522-396,die Buchhandlung,Substantiv,"die Buchhandlung, -en",hiệu sách,Die Buchhandlung am Markt ist geschlossen.,Hiệu sách ở chợ đóng cửa.,Einkauf,2026-05-22,B1,horen/1.95,horen,B1;DTZ;Einkauf,
VOC-20260522-397,der Wasserschaden,Substantiv,"der Wasserschaden, -schäden",hư hại do nước,Die Buchhandlung ist wegen eines Wasserschadens geschlossen.,Hiệu sách đóng cửa do hư hại bởi nước.,Wohnen,2026-05-22,B1,horen/1.95,horen,B1;DTZ;Wohnen,
VOC-20260522-398,die Stromunterbrechung,Substantiv,"die Stromunterbrechung, -en",sự cắt điện,Eine Stromunterbrechung ist nicht der Grund.,Việc cắt điện không phải là lý do.,Technologie,2026-05-22,B1,horen/1.95,horen,B1;DTZ;Technologie,
VOC-20260522-399,das Feuer,Substantiv,"das Feuer, -",lửa/hỏa hoạn,Wegen eines Feuers ist nicht korrekt.,Vì hỏa hoạn là không đúng.,Allgemein,2026-05-22,B1,horen/1.95,horen,B1;DTZ;Allgemein,
VOC-20260522-400,sich melden,Verb,meldete sich - hat sich gemeldet,liên lạc/báo lại,Das Büro wird sich telefonisch melden.,Văn phòng sẽ liên lạc qua điện thoại.,Alltag,2026-05-22,B1,horen/1.96,horen,B1;DTZ;Alltag,reflexive
VOC-20260522-401,telefonisch,Adverb,,qua điện thoại,Das Büro wird sich telefonisch melden.,Văn phòng sẽ liên lạc qua điện thoại.,Alltag,2026-05-22,B1,horen/1.96,horen,B1;DTZ;Alltag,
VOC-20260522-402,erhalten,Verb,erhielt - hat erhalten,nhận được,Sie sollen einen Brief erhalten.,Bạn sẽ nhận được một lá thư.,Allgemein,2026-05-22,B1,horen/1.96,horen,B1;DTZ;Allgemein,
VOC-20260522-403,die Realschule,Substantiv,"die Realschule, -n",trường trung học thực hành,Frau Glück bekommt eine Nachricht von der Realschule.,Bà Glück nhận được thông báo từ trường trung học thực hành.,Bildung,2026-05-22,B1,horen/1.97,horen,B1;DTZ;Bildung,
VOC-20260522-404,mitteilen,Verb,teilte mit - hat mitgeteilt,thông báo/truyền đạt,Ein neuer Termin wird schriftlich mitgeteilt.,Một lịch hẹn mới sẽ được thông báo bằng văn bản.,Behörde,2026-05-22,B1,horen/1.97,horen,B1;DTZ;Behörde,trennbar
VOC-20260522-405,die Ausfahrt,Substantiv,"die Ausfahrt, -en",lối ra (đường cao tốc),Welche Autobahnausfahrt ist gesperrt?,Lối ra nào trên đường cao tốc bị chặn?,Verkehr,2026-05-22,B1,horen/1.98,horen,B1;DTZ;Verkehr,
VOC-20260522-406,die Autobahn,Substantiv,"die Autobahn, -en",đường cao tốc,Die Autobahnausfahrt 15 ist gesperrt.,Lối ra số 15 của đường cao tốc bị chặn.,Verkehr,2026-05-22,B1,horen/1.98,horen,B1;DTZ;Verkehr,
VOC-20260522-407,gesperrt,Adjektiv,,bị chặn/đóng,Die Autobahnausfahrt 15 ist gesperrt.,Lối ra số 15 đường cao tốc bị chặn.,Verkehr,2026-05-22,B1,horen/1.98,horen,B1;DTZ;Verkehr,
VOC-20260522-408,die Zufahrt,Substantiv,"die Zufahrt, -en",đường vào,Die Zufahrt zur Ausfahrt 20 kann beeinträchtigt sein.,Đường vào lối ra số 20 có thể bị ảnh hưởng.,Verkehr,2026-05-22,B1,horen/1.98,horen,B1;DTZ;Verkehr,
VOC-20260522-409,empfehlen,Verb,empfahl - hat empfohlen,khuyến nghị/khuyên,"Es wird empfohlen, alternative Routen zu wählen.",Khuyến nghị chọn các tuyến đường thay thế.,Allgemein,2026-05-22,B1,horen/1.98,horen,B1;DTZ;Allgemein,
VOC-20260522-410,die Route,Substantiv,"die Route, -n",tuyến đường,"Es wird empfohlen, alternative Routen zu wählen.",Khuyến nghị chọn các tuyến đường thay thế.,Verkehr,2026-05-22,B1,horen/1.98,horen,B1;DTZ;Verkehr,
