id,wort,wortart,formen,bedeutung,beispiel,uebersetzung,thema,lerndatum,level,quelle,source_type,tags,notes,parent_id,form_type
VOC-20260522-1282,einarbeiten,Verb,arbeitete ein - hat eingearbeitet,"huấn luyện, đào tạo ban đầu",Meine Kollegen haben mich gut eingearbeitet.,Đồng nghiệp đã đào tạo tôi rất tốt khi mới vào.,Arbeit,2026-05-22,B1,horen/4.14,horen,B1;DTZ;Arbeit,trennbar
VOC-20260522-1283,Strandurlaub,Substantiv,"der Strandurlaub, -e",kỳ nghỉ ở bãi biển,Strandurlaub ist sehr entspannend.,Kỳ nghỉ ở bãi biển rất thư giãn.,Reise,2026-05-22,B1,horen/4.15,horen,B1;DTZ;Reise,
VOC-20260522-1284,Städtereise,Substantiv,"die Städtereise, -n",chuyến đi tham quan thành phố,Städtereisen sind sehr interessant.,Các chuyến đi tham quan thành phố rất thú vị.,Reise,2026-05-22,B1,horen/4.15,horen,B1;DTZ;Reise,
VOC-20260522-1285,Horizont,Substantiv,"der Horizont, -e","tầm nhìn, chân trời",Reisen erweitert den Horizont.,Du lịch mở rộng tầm nhìn.,Reise,2026-05-22,B1,horen/4.15,horen,B1;DTZ;Reise,den Horizont erweitern
VOC-20260522-1286,Erfahrung,Substantiv,"die Erfahrung, -en",trải nghiệm,Letztes Jahr war ich in Japan und es war eine wunderbare Erfahrung.,Năm ngoái tôi ở Nhật và đó là một trải nghiệm tuyệt vời.,Reise,2026-05-22,B1,horen/4.15,horen,B1;DTZ;Reise,
VOC-20260522-1287,fesseln,Verb,fesselte - hat gefesselt,"cuốn hút, mê hoặc",Die Spezialeffekte und die spannende Handlung fesseln mich.,Hiệu ứng đặc biệt và cốt truyện hấp dẫn cuốn hút tôi.,Freizeit,2026-05-22,B1,horen/4.16,horen,B1;DTZ;Freizeit,
VOC-20260522-1288,Lieblingssport,Substantiv,der Lieblingssport,môn thể thao yêu thích,Tennis ist mein Lieblingssport seit meiner Kindheit.,Quần vợt là môn thể thao yêu thích của tôi từ thời thơ ấu.,Freizeit,2026-05-22,B1,horen/4.16,horen,B1;DTZ;Freizeit,
VOC-20260522-1289,eintauchen,Verb,tauchte ein - ist eingetaucht,đắm chìm vào,"Ich finde es entspannend, in ein gutes Buch einzutauchen.",Tôi thấy thư giãn khi đắm chìm vào một cuốn sách hay.,Freizeit,2026-05-22,B1,horen/4.16,horen,B1;DTZ;Freizeit,trennbar
VOC-20260522-1290,Handlung,Substantiv,"die Handlung, -en","cốt truyện, hành động",Die spannende Handlung fesselt mich immer wieder.,Cốt truyện hấp dẫn luôn cuốn hút tôi.,Freizeit,2026-05-22,B1,horen/4.16,horen,B1;DTZ;Freizeit,
VOC-20260522-1291,Gesundheitsversorgung,Substantiv,"die Gesundheitsversorgung, -en",chăm sóc y tế,Der Zugang zur Gesundheitsversorgung sollte ein grundlegendes Recht sein.,Tiếp cận chăm sóc y tế nên là quyền cơ bản.,Gesundheit,2026-05-22,B1,horen/4.17,horen,B1;DTZ;Gesundheit,
VOC-20260522-1292,Lernspiel,Substantiv,"das Lernspiel, -e",trò chơi học tập,In der Grundschule machen die Kinder Lernspiele am Computer.,Tại trường tiểu học trẻ em chơi trò chơi học tập trên máy tính.,Bildung,2026-05-22,B1,horen/4.19,horen,B1;DTZ;Bildung,
VOC-20260522-1293,Sprecher,Substantiv,"der Sprecher, -",người nói,Die Sprecherin kritisiert die Ganztagsschule.,Người nói (nữ) phê bình trường học cả ngày.,Allgemein,2026-05-22,B1,horen/4.19,horen,B1;DTZ;Allgemein,
VOC-20260522-1294,Verkaufsoffener Sonntag,Redemittel,,chủ nhật cửa hàng mở cửa,"Verkaufsoffene Sonntage sollten genutzt werden, um über Umweltthemen zu informieren.",Chủ nhật cửa hàng mở cửa nên được dùng để thông tin về môi trường.,Einkauf,2026-05-22,B1,horen/4.20,horen,B1;DTZ;Einkauf,cụm cố định ở Đức
VOC-20260522-1295,digitale Medien,Redemittel,,phương tiện kỹ thuật số,"Digitale Medien haben das Potenzial, Bildung und Lernen zu verbessern.",Phương tiện kỹ thuật số có tiềm năng cải thiện giáo dục và học tập.,Kommunikation,2026-05-22,B1,horen/4.21,horen,B1;DTZ;Kommunikation,thường số nhiều
VOC-20260522-1296,genussvoll,Adjektiv,,"thưởng thức, đầy hưởng thụ",Sonntage sollten als Tage der genussvollen Ernährung genutzt werden.,Chủ nhật nên là ngày ăn uống đầy hưởng thụ.,Allgemein,2026-05-22,B1,horen/4.22,horen,B1;DTZ;Allgemein,
VOC-20260522-1297,Künstliche Intelligenz,Redemittel,,trí tuệ nhân tạo,Künstliche Intelligenz und Automatisierung dürfen keine Ungerechtigkeiten verstärken.,Trí tuệ nhân tạo và tự động hóa không được làm tăng bất công.,Allgemein,2026-05-22,B1,horen/4.25,horen,B1;DTZ;Allgemein,viết tắt: KI
VOC-20260522-1298,scheitern,Verb,scheiterte - ist gescheitert,thất bại,Verbote führen zu Scheitern.,Sự cấm đoán dẫn đến thất bại.,Allgemein,2026-05-22,B1,horen/4.26,horen,B1;DTZ;Allgemein,ist + Partizip II
VOC-20260522-1299,Arbeitsmodell,Substantiv,"das Arbeitsmodell, -e",mô hình làm việc,Hybride Arbeitsmodelle sind die Zukunft der Arbeit.,Mô hình làm việc lai (kết hợp) là tương lai của công việc.,Arbeit,2026-05-22,B1,horen/4.27,horen,B1;DTZ;Arbeit,
VOC-20260522-1300,Zusammenarbeit,Substantiv,"die Zusammenarbeit, -en",sự hợp tác,Die informellen Gespräche sind für die Zusammenarbeit wichtig.,Các cuộc nói chuyện không chính thức quan trọng cho sự hợp tác.,Arbeit,2026-05-22,B1,horen/4.27,horen,B1;DTZ;Arbeit,
VOC-20260522-1301,Tourismus,Substantiv,der Tourismus,du lịch (ngành),Lokaler Tourismus ist nach der Pandemie besonders wichtig.,Du lịch địa phương đặc biệt quan trọng sau đại dịch.,Reise,2026-05-22,B1,horen/4.28,horen,B1;DTZ;Reise,thường không có số nhiều
VOC-20260522-1302,virtuell,Adjektiv,,ảo,Virtuelle Reiseerlebnisse könnten eine nachhaltige Alternative sein.,Trải nghiệm du lịch ảo có thể là một lựa chọn bền vững.,Reise,2026-05-22,B1,horen/4.28,horen,B1;DTZ;Reise,
VOC-20260522-1303,Digitalisierung,Substantiv,"die Digitalisierung, -en",sự số hóa,Die Digitalisierung verstärkt die Bildungsungleichheit.,Số hóa làm tăng bất bình đẳng trong giáo dục.,Bildung,2026-05-22,B1,horen/4.29,horen,B1;DTZ;Bildung,
VOC-20260522-1304,Bildungsungleichheit,Substantiv,"die Bildungsungleichheit, -en",bất bình đẳng giáo dục,Die Digitalisierung verstärkt die Bildungsungleichheit.,Số hóa làm tăng bất bình đẳng giáo dục.,Bildung,2026-05-22,B1,horen/4.29,horen,B1;DTZ;Bildung,
VOC-20260522-1305,Vorzug,Substantiv,"der Vorzug, -züge",ưu điểm,Traditioneller Unterricht hat seine Vorzüge.,Việc dạy học truyền thống có những ưu điểm của nó.,Bildung,2026-05-22,B1,horen/4.29,horen,B1;DTZ;Bildung,Plural mit Umlaut
VOC-20260522-1306,investieren,Verb,investierte - hat investiert,đầu tư,Schulen sollten in die neuesten Technologien investieren.,Trường học nên đầu tư vào công nghệ mới nhất.,Allgemein,2026-05-22,B1,horen/4.29,horen,B1;DTZ;Allgemein,investieren in + Akk.
VOC-20260522-1307,unersetzlich,Adjektiv,,không thể thay thế,Persönliche Interaktion ist unersetzlich für effektives Lernen.,Tương tác cá nhân là không thể thay thế cho việc học hiệu quả.,Bildung,2026-05-22,B1,horen/4.29,horen,B1;DTZ;Bildung,
VOC-20260522-1308,Zeitersparnis,Substantiv,"die Zeitersparnis, -se",việc tiết kiệm thời gian,Die Zeitersparnis durch Homeoffice ist ein großer Vorteil.,Việc tiết kiệm thời gian nhờ làm việc tại nhà là một ưu điểm lớn.,Arbeit,2026-05-22,B1,horen/4.30,horen,B1;DTZ;Arbeit,
VOC-20260522-1309,Arbeitszeitgestaltung,Substantiv,"die Arbeitszeitgestaltung, -en",việc tổ chức giờ làm,Die flexible Arbeitszeitgestaltung ist der größte Pluspunkt von Homeoffice.,Giờ làm linh hoạt là điểm cộng lớn nhất của làm việc tại nhà.,Arbeit,2026-05-22,B1,horen/4.30,horen,B1;DTZ;Arbeit,
VOC-20260522-1310,Pluspunkt,Substantiv,"der Pluspunkt, -e","điểm cộng, ưu điểm",Die flexible Arbeitszeitgestaltung ist der größte Pluspunkt von Homeoffice.,Giờ làm linh hoạt là điểm cộng lớn nhất.,Allgemein,2026-05-22,B1,horen/4.30,horen,B1;DTZ;Allgemein,
VOC-20260522-1311,Trennung,Substantiv,"die Trennung, -en",sự tách biệt,Die klare Trennung von Arbeit und Freizeit ist im Homeoffice schwierig.,Việc tách biệt rõ ràng giữa công việc và giải trí khó khi làm tại nhà.,Arbeit,2026-05-22,B1,horen/4.30,horen,B1;DTZ;Arbeit,
VOC-20260522-1312,Flexibilisierung,Substantiv,"die Flexibilisierung, -en",sự linh hoạt hóa,Die Flexibilisierung von Arbeitszeiten wird einen höheren Stellenwert haben.,Việc linh hoạt hóa giờ làm sẽ có vị thế cao hơn.,Arbeit,2026-05-22,B1,horen/4.31,horen,B1;DTZ;Arbeit,
VOC-20260522-1313,Stellenwert,Substantiv,"der Stellenwert, -e","vị thế, tầm quan trọng",Die Flexibilisierung von Arbeitszeiten wird einen höheren Stellenwert haben.,Việc linh hoạt giờ làm sẽ có tầm quan trọng cao hơn.,Arbeit,2026-05-22,B1,horen/4.31,horen,B1;DTZ;Arbeit,
VOC-20260522-1314,Herausforderung,Substantiv,"die Herausforderung, -en",thử thách,Es gibt Herausforderungen hinsichtlich sozialer Interaktion.,Có những thử thách về mặt tương tác xã hội.,Allgemein,2026-05-22,B1,horen/4.31,horen,B1;DTZ;Allgemein,
VOC-20260522-1315,psychisch,Adjektiv,,tâm lý,Unternehmen sollten Strategien zur Förderung der psychischen Gesundheit entwickeln.,Các công ty nên phát triển chiến lược thúc đẩy sức khỏe tâm lý.,Gesundheit,2026-05-22,B1,horen/4.31,horen,B1;DTZ;Gesundheit,
VOC-20260522-1316,Arbeitnehmer,Substantiv,"der Arbeitnehmer, -",người lao động,Die Weiterbildung der Arbeitnehmerinnen und Arbeitnehmer ist entscheidend.,Việc đào tạo nâng cao người lao động (nam và nữ) là quyết định.,Arbeit,2026-05-22,B1,horen/4.31,horen,B1;DTZ;Arbeit,
VOC-20260522-1317,Etage,Substantiv,"die Etage, -n",tầng (nhà),4. Etage – Technik & Freizeit,Tầng 4 – Công nghệ & Giải trí,Konsum,2026-05-22,B1,lesen/1.1,lesen,B1;DTZ;Konsum,đồng nghĩa với Stock
VOC-20260522-1318,Untergeschoss,Substantiv,"das Untergeschoss, -e",tầng hầm,Untergeschoss – Schnäppchen & Feiern,Tầng hầm – Hàng giảm giá & Tiệc tùng,Konsum,2026-05-22,B1,lesen/1.1,lesen,B1;DTZ;Konsum,
VOC-20260522-1319,Haushaltswaren,Substantiv,die Haushaltswaren (Pl.),đồ gia dụng,"Haushaltswaren: Kochtöpfe, Pfannen, Küchenhelfer","Đồ gia dụng: Nồi, chảo, dụng cụ nhà bếp",Wohnen,2026-05-22,B1,lesen/1.1,lesen,B1;DTZ;Wohnen,thường dùng số nhiều
VOC-20260522-1320,Heimwerkerbedarf,Substantiv,der Heimwerkerbedarf (Sg.),đồ dùng cho thợ sửa chữa tại nhà,"Heimwerkerbedarf: Werkzeug, Schrauben, Dübel, kleine Reparatursets","Đồ dùng tự sửa chữa: Dụng cụ, ốc vít, nở nhựa, bộ sửa chữa nhỏ",Wohnen,2026-05-22,B1,lesen/1.1,lesen,B1;DTZ;Wohnen,
VOC-20260522-1321,Bettwäsche,Substantiv,die Bettwäsche (Sg.),đồ trải giường,"Bettwäsche & Heimtextilien: Bettbezüge, Tagesdecken, Kissenhüllen","Đồ trải giường & vải dệt gia đình: Vỏ chăn, khăn phủ giường, vỏ gối",Wohnen,2026-05-22,B1,lesen/1.1,lesen,B1;DTZ;Wohnen,
VOC-20260522-1322,Sonderangebot,Substantiv,"das Sonderangebot, -e",mặt hàng giảm giá đặc biệt,"Sonderangebote: Restposten, reduzierte Waren","Hàng giảm giá đặc biệt: Hàng tồn kho, hàng giảm giá",Konsum,2026-05-22,B1,lesen/1.1,lesen,B1;DTZ;Konsum,
VOC-20260522-1323,Hautpflege,Substantiv,die Hautpflege (Sg.),chăm sóc da,"Kosmetik & Hautpflege: Cremes, Make-up, Sonnenschutz","Mỹ phẩm & chăm sóc da: Kem, đồ trang điểm, kem chống nắng",Gesundheit,2026-05-22,B1,lesen/1.1,lesen,B1;DTZ;Gesundheit,
VOC-20260522-1324,Schmuck,Substantiv,der Schmuck (Sg.),đồ trang sức,"Uhren & Schmuck: Armbanduhren, Ketten, Ohrringe","Đồng hồ & trang sức: Đồng hồ đeo tay, dây chuyền, hoa tai",Konsum,2026-05-22,B1,lesen/1.1,lesen,B1;DTZ;Konsum,không có số nhiều
VOC-20260522-1325,Volkshochschule,Substantiv,"die Volkshochschule, -n",trường giáo dục thường xuyên cho người lớn,Wegweiser: Volkshochschule Glückstadt,Bảng chỉ dẫn: Trường giáo dục thường xuyên Glückstadt,Bildung,2026-05-22,B1,lesen/1.2,lesen,B1;DTZ;Bildung,viết tắt VHS
VOC-20260522-1326,Weltanschauung,Substantiv,"die Weltanschauung, -en",thế giới quan,Ethik und Weltanschauung,Đạo đức và thế giới quan,Bildung,2026-05-22,B1,lesen/1.2,lesen,B1;DTZ;Bildung,
VOC-20260522-1327,Handarbeit,Substantiv,"die Handarbeit, -en",công việc thủ công,"Handarbeiten: Nähen, Stricken","Công việc thủ công: May vá, đan len",Freizeit,2026-05-22,B1,lesen/1.2,lesen,B1;DTZ;Freizeit,
VOC-20260522-1328,Bewerbungstraining,Substantiv,"das Bewerbungstraining, -s",khóa huấn luyện xin việc,Bewerbungstraining,Huấn luyện viết hồ sơ xin việc,Arbeit,2026-05-22,B1,lesen/1.2,lesen,B1;DTZ;Arbeit,Bewerbung + Training
VOC-20260522-1329,Büromanagement,Substantiv,das Büromanagement (Sg.),quản lý văn phòng,Büromanagement,Quản lý văn phòng,Arbeit,2026-05-22,B1,lesen/1.2,lesen,B1;DTZ;Arbeit,
VOC-20260522-1330,Freizeitgestaltung,Substantiv,die Freizeitgestaltung (Sg.),việc tổ chức thời gian rảnh,Abteilung 5 – Freizeitgestaltung,Phân khoa 5 – Tổ chức thời gian rảnh,Freizeit,2026-05-22,B1,lesen/1.2,lesen,B1;DTZ;Freizeit,
VOC-20260522-1331,Gesang,Substantiv,"der Gesang, Gesänge",việc ca hát,Gesang,Ca hát,Freizeit,2026-05-22,B1,lesen/1.2,lesen,B1;DTZ;Freizeit,
VOC-20260522-1332,Zubehör,Substantiv,"das Zubehör, -e",phụ kiện đi kèm,Fahrzeuge & Zubehör,Phương tiện & phụ kiện,Konsum,2026-05-22,B1,lesen/1.3,lesen,B1;DTZ;Konsum,thường dùng số ít
VOC-20260522-1333,Ersatzteil,Substantiv,"das Ersatzteil, -e",phụ tùng thay thế,"Reifen, Felgen & Ersatzteile","Lốp xe, vành xe & phụ tùng thay thế",Verkehr,2026-05-22,B1,lesen/1.3,lesen,B1;DTZ;Verkehr,
VOC-20260522-1334,Bürobedarf,Substantiv,der Bürobedarf (Sg.),đồ dùng văn phòng,Sie benötigen Druckerpapier für Ihr Homeoffice.,Bạn cần giấy in cho văn phòng tại nhà.,Arbeit,2026-05-22,B1,lesen/1.3,lesen,B1;DTZ;Arbeit,
VOC-20260522-1335,Briefumschlag,Substantiv,"der Briefumschlag, -umschläge",phong bì thư,"Ordner, Hefte, Briefumschläge","Kẹp tài liệu, vở, phong bì thư",Arbeit,2026-05-22,B1,lesen/1.3,lesen,B1;DTZ;Arbeit,Plural mit Umlaut
VOC-20260522-1336,Festplatte,Substantiv,"die Festplatte, -n",ổ cứng,USB-Sticks & externe Festplatten,USB & ổ cứng ngoài,Technologie,2026-05-22,B1,lesen/1.3,lesen,B1;DTZ;Technologie,
VOC-20260522-1337,Überwachungskamera,Substantiv,"die Überwachungskamera, -s",máy quay giám sát,Smart Home Geräte & Überwachungskameras,Thiết bị nhà thông minh & máy quay giám sát,Technologie,2026-05-22,B1,lesen/1.3,lesen,B1;DTZ;Technologie,
VOC-20260522-1338,Blutdruckmessgerät,Substantiv,"das Blutdruckmessgerät, -e",máy đo huyết áp,Blutdruckmessgeräte & Fieberthermometer,Máy đo huyết áp & nhiệt kế,Gesundheit,2026-05-22,B1,lesen/1.3,lesen,B1;DTZ;Gesundheit,Blut + Druck + Messgerät
VOC-20260522-1339,Hygieneartikel,Substantiv,"der Hygieneartikel, -",sản phẩm vệ sinh,Hygieneartikel & Desinfektionsmittel,Sản phẩm vệ sinh & chất khử trùng,Gesundheit,2026-05-22,B1,lesen/1.3,lesen,B1;DTZ;Gesundheit,
VOC-20260522-1340,Mediathek,Substantiv,"die Mediathek, -en",thư viện truyền thông (online),Online-Mediathek VideoGalaxy,Thư viện truyền thông trực tuyến,Medien,2026-05-22,B1,lesen/1.4,lesen,B1;DTZ;Medien,
VOC-20260522-1341,Handelsroute,Substantiv,"die Handelsroute, -n",tuyến đường thương mại,Die großen Handelsrouten – Von der Salzstraße bis heute,Các tuyến đường thương mại lớn – Từ con đường muối đến hôm nay,Geschichte,2026-05-22,B1,lesen/1.4,lesen,B1;DTZ;Geschichte,
VOC-20260522-1342,Rückenschmerzen,Substantiv,die Rückenschmerzen (Pl.),đau lưng,Rückenschmerzen: Was tun?,Đau lưng: Phải làm gì?,Gesundheit,2026-05-22,B1,lesen/1.4,lesen,B1;DTZ;Gesundheit,thường dùng số nhiều
VOC-20260522-1343,Buchmesse,Substantiv,"die Buchmesse, -n",hội chợ sách,Neuheiten von der Buchmesse – Bestseller im Überblick,Sản phẩm mới từ hội chợ sách,Medien,2026-05-22,B1,lesen/1.4,lesen,B1;DTZ;Medien,
VOC-20260522-1344,Kindersendung,Substantiv,"die Kindersendung, -en",chương trình truyền hình cho trẻ em,Tim und das Feuerwehrabenteuer – Kindersendung,Tim và cuộc phiêu lưu cứu hỏa – Chương trình cho trẻ em,Medien,2026-05-22,B1,lesen/1.4,lesen,B1;DTZ;Medien,
VOC-20260522-1345,Sporthalle,Substantiv,"die Sporthalle, -n",nhà thi đấu thể thao,Sporthalle 15:00 Uhr – Einführung ins Hockey,Nhà thi đấu 15:00 – Giới thiệu về hockey,Freizeit,2026-05-22,B1,lesen/1.5,lesen,B1;DTZ;Freizeit,
VOC-20260522-1346,Aula,Substantiv,"die Aula, Aulen",hội trường (trường học),Aula 15:00 Uhr – Theatervorführung,Hội trường 15:00 – Buổi diễn kịch,Bildung,2026-05-22,B1,lesen/1.5,lesen,B1;DTZ;Bildung,
VOC-20260522-1347,Theatervorführung,Substantiv,"die Theatervorführung, -en",buổi diễn kịch,Theatervorführung Die Antike lebt,Buổi diễn kịch,Kultur,2026-05-22,B1,lesen/1.5,lesen,B1;DTZ;Kultur,Theater + Vorführung
VOC-20260522-1348,Modenschau,Substantiv,"die Modenschau, -en",buổi trình diễn thời trang,17:30 Uhr – Modenschau: Kreative Designs,17:30 – Trình diễn thời trang: Thiết kế sáng tạo,Kultur,2026-05-22,B1,lesen/1.5,lesen,B1;DTZ;Kultur,
VOC-20260522-1349,Fotoausstellung,Substantiv,"die Fotoausstellung, -en",triển lãm ảnh,Begleitend: Fotoausstellung zur Italien-Exkursion,Đi kèm: Triển lãm ảnh về chuyến đi Ý,Kultur,2026-05-22,B1,lesen/1.5,lesen,B1;DTZ;Kultur,
VOC-20260522-1350,Infoveranstaltung,Substantiv,"die Infoveranstaltung, -en",buổi thông tin,15:30 Uhr – Infoveranstaltung: Französisch lernen leicht gemacht,15:30 – Buổi thông tin: Học tiếng Pháp dễ dàng,Bildung,2026-05-22,B1,lesen/1.5,lesen,B1;DTZ;Bildung,Info + Veranstaltung
VOC-20260522-1351,Pausenbereich,Substantiv,"der Pausenbereich, -e",khu vực giải lao,Pausenbereich (15:00–22:00 Uhr),Khu vực giải lao (15:00–22:00),Freizeit,2026-05-22,B1,lesen/1.5,lesen,B1;DTZ;Freizeit,
VOC-20260522-1352,Innenhof,Substantiv,"der Innenhof, -höfe",sân trong,Innenhof (15:00–18:00 Uhr),Sân trong (15:00–18:00),Wohnen,2026-05-22,B1,lesen/1.5,lesen,B1;DTZ;Wohnen,Plural mit Umlaut
VOC-20260522-1353,Infostand,Substantiv,"der Infostand, -stände",quầy thông tin,Infostand: Von der Gründung bis heute – die Geschichte unseres Zentrums,Quầy thông tin: Từ ngày thành lập đến nay,Freizeit,2026-05-22,B1,lesen/1.5,lesen,B1;DTZ;Freizeit,Plural mit Umlaut
VOC-20260522-1354,Gründung,Substantiv,"die Gründung, -en",việc thành lập,Von der Gründung bis heute – die Geschichte unseres Zentrums,Từ ngày thành lập đến nay – Lịch sử trung tâm,Geschichte,2026-05-22,B1,lesen/1.5,lesen,B1;DTZ;Geschichte,von gründen abgeleitet
VOC-20260522-1355,Nahverkehr,Substantiv,der Nahverkehr (kein Pl.),giao thông công cộng nội đô,"Die BVG prüft aktuell verschiedene Möglichkeiten, den Nahverkehr der Zukunft sicher und zuverlässig zu gestalten.",BVG hiện đang xem xét nhiều khả năng để thiết kế giao thông nội đô tương lai an toàn và đáng tin cậy.,Verkehr,2026-05-22,B1,lesen/3.1,lesen,B1;DTZ;Verkehr,
VOC-20260522-1356,fahrerlos,Adjektiv,"fahrerlos, -e, -er, -es",không người lái,In zwei Berliner Stadtteilen sind bereits fahrerlose Busse im Einsatz.,Tại hai khu của Berlin đã có xe buýt không người lái được đưa vào sử dụng.,Verkehr,2026-05-22,B1,lesen/3.1,lesen,B1;DTZ;Verkehr,
VOC-20260522-1357,Aufsichtspersonal,Substantiv,das Aufsichtspersonal (kein Pl.),nhân viên giám sát,Fahrerlose Busse sind im Einsatz – zunächst mit Aufsichtspersonal an Bord.,Xe buýt không người lái đang được sử dụng – ban đầu có nhân viên giám sát trên xe.,Arbeit,2026-05-22,B1,lesen/3.1,lesen,B1;DTZ;Arbeit,
VOC-20260522-1358,Gewerkschaft,Substantiv,"die Gewerkschaft, -en",công đoàn,Die Gewerkschaft sieht die Entwicklung kritisch.,Công đoàn nhìn nhận sự phát triển này một cách phê phán.,Arbeit,2026-05-22,B1,lesen/3.1,lesen,B1;DTZ;Arbeit,
VOC-20260522-1359,befürchten,Verb,befürchtete - hat befürchtet,"lo ngại, e ngại",Sie befürchtet den Verlust vieler Arbeitsplätze.,Công đoàn lo ngại việc mất nhiều việc làm.,Arbeit,2026-05-22,B1,lesen/3.1,lesen,B1;DTZ;Arbeit,
VOC-20260522-1360,Ansprechpartner,Substantiv,"der Ansprechpartner, -","người liên hệ, đầu mối",Fahrerinnen und Fahrer sind wichtige Ansprechpartner für Fahrgäste.,Tài xế là đầu mối liên hệ quan trọng cho hành khách.,Arbeit,2026-05-22,B1,lesen/3.1,lesen,B1;DTZ;Arbeit,
VOC-20260522-1361,Befürworter,Substantiv,"der Befürworter, -",người ủng hộ,"Befürworter autonomer Systeme argumentieren, dass fahrerlose Busse eine verlässliche Lösung wären.",Những người ủng hộ hệ thống tự lái lập luận rằng xe buýt không người lái sẽ là giải pháp đáng tin cậy.,Verkehr,2026-05-22,B1,lesen/3.1,lesen,B1;DTZ;Verkehr,
VOC-20260522-1362,Busnetz,Substantiv,"das Busnetz, -e",mạng lưới xe buýt,Die Fahrpläne im städtischen Busnetz ändern sich.,Lịch trình trong mạng lưới xe buýt thành phố thay đổi.,Verkehr,2026-05-22,B1,lesen/3.2,lesen,B1;DTZ;Verkehr,
VOC-20260522-1363,unverändert,Adjektiv,unverändert,không thay đổi,Die Verbindungen von U-Bahnen und Straßenbahnen bleiben jedoch unverändert.,"Tuy nhiên, các tuyến tàu điện ngầm và xe điện vẫn không thay đổi.",Verkehr,2026-05-22,B1,lesen/3.2,lesen,B1;DTZ;Verkehr,
VOC-20260522-1364,Neuerung,Substantiv,"die Neuerung, -en","sự đổi mới, điểm mới",Die wichtigsten Neuerungen betreffen die Linien 35 und 84.,Những điểm mới quan trọng nhất liên quan đến các tuyến 35 và 84.,Verkehr,2026-05-22,B1,lesen/3.2,lesen,B1;DTZ;Verkehr,
VOC-20260522-1365,Messegelände,Substantiv,"das Messegelände, -",khu hội chợ triển lãm,Die Linie 35 fährt künftig nicht mehr bis zum Messegelände.,Tuyến 35 từ nay không còn chạy đến khu hội chợ nữa.,Verkehr,2026-05-22,B1,lesen/3.2,lesen,B1;DTZ;Verkehr,
VOC-20260522-1366,Taktung,Substantiv,"die Taktung, -en",tần suất chạy (xe/tàu),Gleichzeitig wird die Taktung erhöht – ab sofort fährt die Linie 35 viermal pro Stunde.,Đồng thời tần suất được tăng lên – từ nay tuyến 35 chạy bốn lần mỗi giờ.,Verkehr,2026-05-22,B1,lesen/3.2,lesen,B1;DTZ;Verkehr,
VOC-20260522-1367,Verkehrsverwaltung,Substantiv,"die Verkehrsverwaltung, -en",cơ quan quản lý giao thông,Ihre Verkehrsverwaltung Stuttgart,Cơ quan quản lý giao thông Stuttgart của quý vị.,Behörde,2026-05-22,B1,lesen/3.2,lesen,B1;DTZ;Behörde,
VOC-20260522-1368,Krankenkasse,Substantiv,"die Krankenkasse, -n",quỹ bảo hiểm y tế,Neues Angebot Ihrer Krankenkasse,Đề nghị mới từ quỹ bảo hiểm y tế của quý vị.,Gesundheit,2026-05-22,B1,lesen/3.3,lesen,B1;DTZ;Gesundheit,
VOC-20260522-1369,treu,Adjektiv,"treu, -e, -er, -es",trung thành,Als treue Kundin erhalten Sie ein exklusives Angebot.,"Là khách hàng trung thành, quý vị nhận được đề nghị đặc biệt.",Konsum,2026-05-22,B1,lesen/3.3,lesen,B1;DTZ;Konsum,
VOC-20260522-1370,erstatten,Verb,erstattete - hat erstattet,"hoàn lại, bồi hoàn",In diesem Tarif erstatten wir Ihnen Geld zurück.,"Trong gói này, chúng tôi hoàn lại tiền cho quý vị.",Gesundheit,2026-05-22,B1,lesen/3.3,lesen,B1;DTZ;Gesundheit,
VOC-20260522-1371,zertifiziert,Adjektiv,"zertifiziert, -e, -er, -es",được chứng nhận,Oder Sie buchen einen zertifizierten Kurs im Bereich Bewegung oder Ernährung.,Hoặc quý vị đặt một khóa học được chứng nhận trong lĩnh vực vận động hoặc dinh dưỡng.,Gesundheit,2026-05-22,B1,lesen/3.3,lesen,B1;DTZ;Gesundheit,
VOC-20260522-1372,Sportverein,Substantiv,"der Sportverein, -e",câu lạc bộ thể thao,"Wenn Sie Mitglied in einem Sportverein sind, übernehmen wir bis zu 50 % Ihrer Beiträge.","Nếu quý vị là thành viên câu lạc bộ thể thao, chúng tôi chi trả tới 50% phí.",Freizeit,2026-05-22,B1,lesen/3.3,lesen,B1;DTZ;Freizeit,
VOC-20260522-1373,Berufsabschluss,Substantiv,"der Berufsabschluss, -abschlüsse",bằng cấp/chứng chỉ nghề nghiệp,Ein neuer Weg zum Berufsabschluss,Một con đường mới để có bằng nghề.,Arbeit,2026-05-22,B1,lesen/3.4,lesen,B1;DTZ;Arbeit,
VOC-20260522-1374,Berufsausbildung,Substantiv,"die Berufsausbildung, -en",đào tạo nghề,"In Deutschland gibt es viele Menschen, die keine abgeschlossene Berufsausbildung haben.",Ở Đức có nhiều người không có khóa đào tạo nghề đã hoàn thành.,Arbeit,2026-05-22,B1,lesen/3.4,lesen,B1;DTZ;Arbeit,
VOC-20260522-1375,Arbeitsmarkt,Substantiv,"der Arbeitsmarkt, -märkte",thị trường lao động,Diese Personen haben auf dem Arbeitsmarkt schlechtere Chancen.,Những người này có cơ hội kém hơn trên thị trường lao động.,Arbeit,2026-05-22,B1,lesen/3.4,lesen,B1;DTZ;Arbeit,
VOC-20260522-1376,Teilnehmer,Substantiv,"der Teilnehmer, -",người tham gia,Die Teilnehmerinnen und Teilnehmer besuchen keinen regulären Berufsschulunterricht.,Người tham gia không học theo trường nghề thông thường.,Bildung,2026-05-22,B1,lesen/3.4,lesen,B1;DTZ;Bildung,
