id,wort,wortart,formen,bedeutung,beispiel,uebersetzung,thema,lerndatum,level,quelle,source_type,tags,notes,parent_id,form_type
VOC-20260522-855,trocken,Adjektiv,,khô ráo,Im Osten bleibt es trocken.,Phía đông vẫn khô ráo.,Wetter,2026-05-22,B1,horen/2.63,horen,B1;DTZ;Wetter,
VOC-20260522-856,kühl,Adjektiv,,mát / hơi lạnh,Im Norden wird es kühl bleiben.,Phía bắc sẽ vẫn mát.,Wetter,2026-05-22,B1,horen/2.63,horen,B1;DTZ;Wetter,
VOC-20260522-857,Grad,Substantiv,"das Grad, -e",độ (nhiệt độ),Es werden 25 Grad erwartet.,Dự kiến 25 độ.,Wetter,2026-05-22,B1,horen/2.63,horen,B1;DTZ;Wetter,
VOC-20260522-858,Wetterbericht,Substantiv,"der Wetterbericht, -e",bản tin thời tiết,Der Wetterbericht kommt nach den Nachrichten.,Bản tin thời tiết đến sau tin tức.,Wetter,2026-05-22,B1,horen/2.64,horen,B1;DTZ;Wetter,
VOC-20260522-859,international,Adjektiv,,quốc tế,Nun zu den internationalen Nachrichten.,Bây giờ chuyển sang tin tức quốc tế.,Allgemein,2026-05-22,B1,horen/2.64,horen,B1;DTZ;Allgemein,
VOC-20260522-860,Löscharbeiten,Substantiv,die Löscharbeiten (Plural),công tác chữa cháy,Bitte stören Sie die Löscharbeiten nicht.,Xin đừng cản trở công tác chữa cháy.,Behörde,2026-05-22,B1,horen/2.65,horen,B1;DTZ;Behörde,
VOC-20260522-861,stören,Verb,störte - hat gestört,làm phiền / cản trở,Stören Sie die Arbeit der Feuerwehr nicht.,Đừng cản trở công việc của lính cứu hỏa.,Allgemein,2026-05-22,B1,horen/2.65,horen,B1;DTZ;Allgemein,
VOC-20260522-862,Einsatzort,Substantiv,"der Einsatzort, -e",hiện trường (làm nhiệm vụ),Meiden Sie den Einsatzort der Feuerwehr.,Hãy tránh xa hiện trường của đội cứu hỏa.,Behörde,2026-05-22,B1,horen/2.65,horen,B1;DTZ;Behörde,
VOC-20260522-863,meiden,Verb,mied - hat gemieden,tránh xa,Meiden Sie den Bereich um den Brand.,Hãy tránh khu vực quanh đám cháy.,Allgemein,2026-05-22,B1,horen/2.65,horen,B1;DTZ;Allgemein,
VOC-20260522-864,Einwohner,Substantiv,"der Einwohner, -",cư dân,Die Einwohner sollen ihre Fenster schließen.,Cư dân nên đóng cửa sổ.,Wohnen,2026-05-22,B1,horen/2.65,horen,B1;DTZ;Wohnen,
VOC-20260522-865,Feuerwehr,Substantiv,"die Feuerwehr, -en",đội cứu hỏa,Die Feuerwehr ist im Einsatz.,Đội cứu hỏa đang làm nhiệm vụ.,Behörde,2026-05-22,B1,horen/2.65,horen,B1;DTZ;Behörde,
VOC-20260522-866,Stadtteil,Substantiv,"der Stadtteil, -e",khu phố / quận,Die Einwohner des Stadtteils werden informiert.,Cư dân khu phố được thông báo.,Wohnen,2026-05-22,B1,horen/2.65,horen,B1;DTZ;Wohnen,
VOC-20260522-867,Ausstrahlung,Substantiv,"die Ausstrahlung, -en",việc phát sóng,Die Ausstrahlung des Krimis entfällt heute.,Việc phát sóng phim hình sự hôm nay bị hủy.,Freizeit,2026-05-22,B1,horen/2.66,horen,B1;DTZ;Freizeit,
VOC-20260522-868,Videotext,Substantiv,"der Videotext, -e",videotext / teletext,Den neuen Termin finden Sie im Videotext.,Bạn có thể tìm lịch mới trong videotext.,Technologie,2026-05-22,B1,horen/2.66,horen,B1;DTZ;Technologie,
VOC-20260522-869,Ratschlag,Substantiv,"der Ratschlag, -̈e",lời khuyên,Es gibt Ratschläge für Fahrzeughalter.,Có lời khuyên cho chủ phương tiện.,Behörde,2026-05-22,B1,horen/2.67,horen,B1;DTZ;Behörde,
VOC-20260522-870,Fahrzeughalter,Substantiv,"der Fahrzeughalter, -",chủ xe / chủ phương tiện,Fahrzeughalter müssen die Versicherung jährlich überprüfen.,Chủ xe phải kiểm tra bảo hiểm hàng năm.,Behörde,2026-05-22,B1,horen/2.67,horen,B1;DTZ;Behörde,
VOC-20260522-871,Einblick,Substantiv,"der Einblick, -e",cái nhìn / sự hiểu biết,Sie erhalten wichtige Einblicke in das Thema.,Bạn sẽ có những hiểu biết quan trọng về chủ đề.,Bildung,2026-05-22,B1,horen/2.67,horen,B1;DTZ;Bildung,
VOC-20260522-872,rechtlich,Adjektiv,,thuộc pháp lý,Es geht um rechtliche und finanzielle Ratschläge.,Đây là về lời khuyên pháp lý và tài chính.,Behörde,2026-05-22,B1,horen/2.67,horen,B1;DTZ;Behörde,
VOC-20260522-873,finanziell,Adjektiv,,thuộc tài chính,Finanzielle Ratschläge helfen beim Sparen.,Lời khuyên tài chính giúp tiết kiệm.,Allgemein,2026-05-22,B1,horen/2.67,horen,B1;DTZ;Allgemein,
VOC-20260522-874,steigend,Adjektiv,,đang tăng,Steigende Temperaturen am Wochenende.,Nhiệt độ đang tăng vào cuối tuần.,Wetter,2026-05-22,B1,horen/2.68,horen,B1;DTZ;Wetter,
VOC-20260522-875,windig,Adjektiv,,có gió / nhiều gió,Am Freitag wird es sehr windig.,Thứ sáu sẽ rất nhiều gió.,Wetter,2026-05-22,B1,horen/2.68,horen,B1;DTZ;Wetter,
VOC-20260522-876,begleiten,Verb,begleitete - hat begleitet,đi kèm / đồng hành,Die Sonne wird von steigenden Temperaturen begleitet.,Ánh nắng đi kèm với nhiệt độ tăng.,Allgemein,2026-05-22,B1,horen/2.68,horen,B1;DTZ;Allgemein,
VOC-20260522-877,Baumaterial,Substantiv,"das Baumaterial, -ien",vật liệu xây dựng,Auf der A5 liegen Baumaterialien auf der Fahrbahn.,Trên A5 có vật liệu xây dựng trên mặt đường.,Verkehr,2026-05-22,B1,horen/2.69,horen,B1;DTZ;Verkehr,
VOC-20260522-878,LKW-Unfall,Substantiv,"der LKW-Unfall, -̈e",tai nạn xe tải,Nach einem LKW-Unfall ist die Strecke gesperrt.,Sau một tai nạn xe tải đoạn đường bị đóng.,Verkehr,2026-05-22,B1,horen/2.69,horen,B1;DTZ;Verkehr,
VOC-20260522-879,Radfahrer,Substantiv,"der Radfahrer, -",người đi xe đạp,Auf der A53 wurden Radfahrer gesichtet.,Trên A53 đã phát hiện người đi xe đạp.,Verkehr,2026-05-22,B1,horen/2.69,horen,B1;DTZ;Verkehr,
VOC-20260522-880,sichten,Verb,sichtete - hat gesichtet,phát hiện / nhìn thấy,Radfahrer wurden auf der Autobahn gesichtet.,Người đi xe đạp đã được phát hiện trên cao tốc.,Verkehr,2026-05-22,B1,horen/2.69,horen,B1;DTZ;Verkehr,
VOC-20260522-881,suchen,Verb,suchte - hat gesucht,tìm kiếm,Herr Müller wird von der Polizei gesucht.,Ông Müller đang bị cảnh sát truy tìm.,Behörde,2026-05-22,B1,horen/2.70,horen,B1;DTZ;Behörde,
VOC-20260522-882,Orientierungsschwierigkeit,Substantiv,"die Orientierungsschwierigkeit, -en",khó khăn về định hướng,Herr Müller hat Orientierungsschwierigkeiten.,Ông Müller có khó khăn trong việc định hướng.,Gesundheit,2026-05-22,B1,horen/2.70,horen,B1;DTZ;Gesundheit,
VOC-20260522-883,Polizei,Substantiv,"die Polizei, kein Plural",cảnh sát,Die Polizei sucht den Vermissten.,Cảnh sát đang tìm người mất tích.,Behörde,2026-05-22,B1,horen/2.70,horen,B1;DTZ;Behörde,
VOC-20260522-884,Einkaufsgutschein,Substantiv,"der Einkaufsgutschein, -e",phiếu mua hàng,Es gibt Einkaufsgutscheine zu gewinnen.,Có phiếu mua hàng để trúng thưởng.,Einkauf,2026-05-22,B1,horen/2.71,horen,B1;DTZ;Einkauf,
VOC-20260522-885,Urlaub,Substantiv,"der Urlaub, -e",kỳ nghỉ,Eine Woche Urlaub in Paris für zwei Personen.,Một tuần nghỉ tại Paris cho hai người.,Reisen,2026-05-22,B1,horen/2.71,horen,B1;DTZ;Reisen,
VOC-20260522-886,vorsichtig,Adjektiv,,cẩn thận,Auf der A4 muss man sehr vorsichtig fahren.,Trên A4 phải lái xe rất cẩn thận.,Verkehr,2026-05-22,B1,horen/2.72,horen,B1;DTZ;Verkehr,
VOC-20260522-887,entgegenkommen,Verb,kam entgegen - ist entgegengekommen,đi ngược chiều / đến từ phía đối diện,Auf der A4 kommt Ihnen ein Fahrzeug entgegen.,Trên A4 có một xe đi ngược chiều phía bạn.,Verkehr,2026-05-22,B1,horen/2.72,horen,B1;DTZ;Verkehr,
VOC-20260522-888,Fahrspur,Substantiv,"die Fahrspur, -en",làn xe,Bleiben Sie auf der rechten Fahrspur.,Hãy giữ làn xe bên phải.,Verkehr,2026-05-22,B1,horen/2.72,horen,B1;DTZ;Verkehr,
VOC-20260522-889,überholen,Verb,überholte - hat überholt,vượt (xe),Überholen Sie nicht auf dieser Strecke.,Đừng vượt trên đoạn đường này.,Verkehr,2026-05-22,B1,horen/2.72,horen,B1;DTZ;Verkehr,
VOC-20260522-890,Vorsichtsmaßnahme,Substantiv,"die Vorsichtsmaßnahme, -n",biện pháp phòng ngừa,Es gibt besondere Vorsichtsmaßnahmen auf der A4.,Có những biện pháp phòng ngừa đặc biệt trên A4.,Verkehr,2026-05-22,B1,horen/2.72,horen,B1;DTZ;Verkehr,
VOC-20260522-891,Risiko,Substantiv,"das Risiko, Risiken",rủi ro,Ein entgegenkommendes Fahrzeug stellt ein Risiko dar.,Một xe đi ngược chiều là một rủi ro.,Verkehr,2026-05-22,B1,horen/2.72,horen,B1;DTZ;Verkehr,
VOC-20260522-892,Jobsuche,Substantiv,"die Jobsuche, -n",việc tìm việc làm,Am Mittwoch gibt es Tipps zur Jobsuche.,Thứ tư có các mẹo tìm việc.,Arbeit,2026-05-22,B1,horen/2.73,horen,B1;DTZ;Arbeit,
VOC-20260522-893,Jobberater,Substantiv,"der Jobberater, -",tư vấn nghề nghiệp,Jobberater sprechen über das Berufsleben.,Tư vấn nghề nghiệp nói về cuộc sống công việc.,Arbeit,2026-05-22,B1,horen/2.73,horen,B1;DTZ;Arbeit,
VOC-20260522-894,Arbeitswelt,Substantiv,"die Arbeitswelt, -en",thế giới việc làm,Einblick in die Arbeitswelt am Mittwoch.,Một góc nhìn về thế giới việc làm vào thứ tư.,Arbeit,2026-05-22,B1,horen/2.73,horen,B1;DTZ;Arbeit,
VOC-20260522-895,Berufsleben,Substantiv,"das Berufsleben, kein Plural",đời sống nghề nghiệp,Jobberater sprechen über das Berufsleben.,Tư vấn nghề nghiệp nói về đời sống nghề nghiệp.,Arbeit,2026-05-22,B1,horen/2.73,horen,B1;DTZ;Arbeit,
VOC-20260522-896,Bewölkung,Substantiv,"die Bewölkung, kein Plural",mây / lượng mây,Es herrscht eine beträchtliche Bewölkung im Norden.,Phía bắc có nhiều mây đáng kể.,Wetter,2026-05-22,B1,horen/2.74,horen,B1;DTZ;Wetter,
VOC-20260522-897,beträchtlich,Adjektiv,,đáng kể,Es gibt eine beträchtliche Bewölkung.,Có lượng mây đáng kể.,Wetter,2026-05-22,B1,horen/2.74,horen,B1;DTZ;Wetter,
VOC-20260522-898,prognostizieren,Verb,prognostizierte - hat prognostiziert,dự báo,Für Süddeutschland wird kein Regen prognostiziert.,Cho miền nam nước Đức không dự báo có mưa.,Wetter,2026-05-22,B1,horen/2.74,horen,B1;DTZ;Wetter,
VOC-20260522-899,Schnee,Substantiv,"der Schnee, kein Plural",tuyết,Im Norden gibt es Schnee.,Phía bắc có tuyết.,Wetter,2026-05-22,B1,horen/2.74,horen,B1;DTZ;Wetter,
VOC-20260522-900,Vorsorgeuntersuchung,Substantiv,"die Vorsorgeuntersuchung, -en",khám sức khỏe phòng ngừa,Regelmäßige Vorsorgeuntersuchungen sind wichtig.,Khám sức khỏe phòng ngừa định kỳ rất quan trọng.,Gesundheit,2026-05-22,B1,horen/2.75,horen,B1;DTZ;Gesundheit,
VOC-20260522-901,Zuschuss,Substantiv,"der Zuschuss, -̈e",khoản trợ cấp / hỗ trợ,Sie erhalten höhere Zuschüsse für Zahnbehandlungen.,Bạn nhận được khoản hỗ trợ cao hơn cho điều trị răng.,Gesundheit,2026-05-22,B1,horen/2.75,horen,B1;DTZ;Gesundheit,
VOC-20260522-902,Krankenkassenbeitrag,Substantiv,"der Krankenkassenbeitrag, -̈e",phí bảo hiểm y tế,Die Krankenkassenbeiträge steigen jedes Jahr.,Phí bảo hiểm y tế tăng mỗi năm.,Gesundheit,2026-05-22,B1,horen/2.75,horen,B1;DTZ;Gesundheit,
VOC-20260522-903,Kostenminimierung,Substantiv,"die Kostenminimierung, -en",việc giảm thiểu chi phí,Die Sendung konzentriert sich auf Kostenminimierung.,Chương trình tập trung vào việc giảm thiểu chi phí.,Gesundheit,2026-05-22,B1,horen/2.75,horen,B1;DTZ;Gesundheit,
VOC-20260522-904,Bauarbeiten,Substantiv,die Bauarbeiten (Plural),công việc thi công,Auf der A7 gibt es Bauarbeiten.,Trên A7 đang có công việc thi công.,Verkehr,2026-05-22,B1,horen/2.76,horen,B1;DTZ;Verkehr,
VOC-20260522-905,Eisenbahnbrücke,Substantiv,"die Eisenbahnbrücke, -n",cầu đường sắt,Eine neue Eisenbahnbrücke wird gebaut.,Một cây cầu đường sắt mới đang được xây.,Verkehr,2026-05-22,B1,horen/2.76,horen,B1;DTZ;Verkehr,
VOC-20260522-906,Umleitung,Substantiv,"die Umleitung, -en",đường vòng / lộ trình thay thế,Es gibt eine Umleitung wegen der Bauarbeiten.,Có một đường vòng do thi công.,Verkehr,2026-05-22,B1,horen/2.76,horen,B1;DTZ;Verkehr,
VOC-20260522-907,Autobahn,Substantiv,"die Autobahn, -en",đường cao tốc,Die Autobahn A7 ist teilweise gesperrt.,Cao tốc A7 bị đóng một phần.,Verkehr,2026-05-22,B1,horen/2.76,horen,B1;DTZ;Verkehr,
VOC-20260522-908,Mitteilung,Substantiv,"die Mitteilung, -en",thông báo / thư báo,Eine wichtige Mitteilung kommt im Radio.,Một thông báo quan trọng phát trên đài.,Allgemein,2026-05-22,B1,horen/2.77,horen,B1;DTZ;Allgemein,
VOC-20260522-909,Politik,Substantiv,"die Politik, kein Plural",chính trị,Es gibt eine Sendung über Wirtschaft und Politik.,Có một chương trình về kinh tế và chính trị.,Gesellschaft,2026-05-22,B1,horen/2.77,horen,B1;DTZ;Gesellschaft,
VOC-20260522-910,Auswirkung,Substantiv,"die Auswirkung, -en",tác động / hệ quả,Die Auswirkungen der Krise werden diskutiert.,Tác động của khủng hoảng được thảo luận.,Gesellschaft,2026-05-22,B1,horen/2.77,horen,B1;DTZ;Gesellschaft,
VOC-20260522-911,Krise,Substantiv,"die Krise, -n",khủng hoảng,Die Bankenkrise hat große Auswirkungen.,Khủng hoảng ngân hàng có tác động lớn.,Gesellschaft,2026-05-22,B1,horen/2.77,horen,B1;DTZ;Gesellschaft,
VOC-20260522-912,diskutieren,Verb,diskutierte - hat diskutiert,thảo luận,Politiker diskutieren über die Krise.,Các chính trị gia thảo luận về khủng hoảng.,Gesellschaft,2026-05-22,B1,horen/2.77,horen,B1;DTZ;Gesellschaft,
VOC-20260522-913,Komödie,Substantiv,"die Komödie, -n",phim hài / kịch hài,Die geplante Komödie entfällt heute.,Vở hài kịch dự kiến hôm nay bị hủy.,Freizeit,2026-05-22,B1,horen/2.77,horen,B1;DTZ;Freizeit,
VOC-20260522-914,Ankündigung,Substantiv,"die Ankündigung, -en",thông báo / thông cáo,Eine dringende Ankündigung wird gemacht.,Một thông báo khẩn được đưa ra.,Allgemein,2026-05-22,B1,horen/2.78,horen,B1;DTZ;Allgemein,
VOC-20260522-915,Verkehrsunfall,Substantiv,"der Verkehrsunfall, -̈e",tai nạn giao thông,Wegen eines Verkehrsunfalls ist die Straße gesperrt.,Đường bị đóng do tai nạn giao thông.,Verkehr,2026-05-22,B1,horen/2.78,horen,B1;DTZ;Verkehr,
VOC-20260522-916,Vollkornprodukt,Substantiv,"das Vollkornprodukt, -e",sản phẩm ngũ cốc nguyên hạt,Vollkornprodukte gehören zu einer gesunden Ernährung.,Sản phẩm ngũ cốc nguyên hạt thuộc về chế độ ăn lành mạnh.,Gesundheit,2026-05-22,B1,horen/2.79,horen,B1;DTZ;Gesundheit,
VOC-20260522-917,Eiweiß,Substantiv,"das Eiweiß, -e",protein / lòng trắng trứng,Mageres Eiweiß ist gut für die Gesundheit.,Protein ít béo tốt cho sức khỏe.,Gesundheit,2026-05-22,B1,horen/2.79,horen,B1;DTZ;Gesundheit,
VOC-20260522-918,mager,Adjektiv,,ít béo / nạc,Mageres Fleisch ist gesünder.,Thịt nạc lành mạnh hơn.,Gesundheit,2026-05-22,B1,horen/2.79,horen,B1;DTZ;Gesundheit,
VOC-20260522-919,fettig,Adjektiv,,nhiều dầu mỡ,Vermeiden Sie fettige Lebensmittel.,Hãy tránh thực phẩm nhiều dầu mỡ.,Gesundheit,2026-05-22,B1,horen/2.79,horen,B1;DTZ;Gesundheit,
VOC-20260522-920,Werbung,Substantiv,"die Werbung, -en",quảng cáo,In der Werbung wird gesunde Ernährung empfohlen.,Trong quảng cáo khuyến khích ăn uống lành mạnh.,Allgemein,2026-05-22,B1,horen/2.79,horen,B1;DTZ;Allgemein,
VOC-20260522-921,Wetterlage,Substantiv,"die Wetterlage, -n",tình hình thời tiết,Die Wetterlage ändert sich nächste Woche.,Tình hình thời tiết sẽ thay đổi tuần tới.,Wetter,2026-05-22,B1,horen/2.80,horen,B1;DTZ;Wetter,
VOC-20260522-922,fallend,Adjektiv,,đang giảm,Fallende Temperaturen werden prognostiziert.,Dự báo nhiệt độ đang giảm.,Wetter,2026-05-22,B1,horen/2.80,horen,B1;DTZ;Wetter,
VOC-20260522-923,Hitzegewitter,Substantiv,"das Hitzegewitter, -",cơn dông do nắng nóng,Lokale Hitzegewitter werden am Wochenende erwartet.,Cuối tuần dự kiến có dông do nắng nóng cục bộ.,Wetter,2026-05-22,B1,horen/2.80,horen,B1;DTZ;Wetter,
VOC-20260522-924,deutschlandweit,Adjektiv,,trên toàn nước Đức,Deutschlandweit fallen die Temperaturen.,Trên toàn nước Đức nhiệt độ giảm.,Wetter,2026-05-22,B1,horen/2.80,horen,B1;DTZ;Wetter,
VOC-20260522-925,Verkehrsbehinderung,Substantiv,"die Verkehrsbehinderung, -en",cản trở giao thông,Es gibt Verkehrsbehinderungen wegen Regen.,Có cản trở giao thông do mưa.,Verkehr,2026-05-22,B1,horen/2.81,horen,B1;DTZ;Verkehr,
VOC-20260522-926,Verkehrslage,Substantiv,"die Verkehrslage, -n",tình hình giao thông,Die Verkehrslage ist schlecht.,Tình hình giao thông xấu.,Verkehr,2026-05-22,B1,horen/2.81,horen,B1;DTZ;Verkehr,
VOC-20260522-927,Autofahrer,Substantiv,"der Autofahrer, -",người lái xe ô tô,Die Meldung ist für Autofahrer relevant.,Bản tin có liên quan đến người lái xe.,Verkehr,2026-05-22,B1,horen/2.81,horen,B1;DTZ;Verkehr,
VOC-20260522-928,Regen,Substantiv,"der Regen, kein Plural",mưa,Wegen Regen gibt es Verkehrsprobleme.,Vì mưa có vấn đề giao thông.,Wetter,2026-05-22,B1,horen/2.81,horen,B1;DTZ;Wetter,
VOC-20260522-929,Sonne,Substantiv,"die Sonne, -n",mặt trời,Im Westen scheint hauptsächlich die Sonne.,Ở phía tây chủ yếu có mặt trời.,Wetter,2026-05-22,B1,horen/2.82,horen,B1;DTZ;Wetter,
VOC-20260522-930,hauptsächlich,Adverb,,chủ yếu,Im Westen scheint hauptsächlich die Sonne.,Phía tây chủ yếu có mặt trời.,Allgemein,2026-05-22,B1,horen/2.82,horen,B1;DTZ;Allgemein,
VOC-20260522-931,Lage,Substantiv,"die Lage, -n",vị trí / vùng,In tieferen Lagen wird Schnee erwartet.,Ở các vùng thấp hơn dự kiến có tuyết.,Allgemein,2026-05-22,B1,horen/2.82,horen,B1;DTZ;Allgemein,
VOC-20260522-932,Fahrzeugbrand,Substantiv,"der Fahrzeugbrand, -̈e",vụ cháy xe,Ein Fahrzeugbrand sorgt für Stau auf der A7.,Một vụ cháy xe gây kẹt xe trên A7.,Verkehr,2026-05-22,B1,horen/2.83,horen,B1;DTZ;Verkehr,
VOC-20260522-933,massiv,Adjektiv,,lớn / nghiêm trọng,Es gibt massive Staus auf der A7.,Có những đoạn kẹt xe lớn trên A7.,Verkehr,2026-05-22,B1,horen/2.83,horen,B1;DTZ;Verkehr,
VOC-20260522-934,Baustellenverzögerung,Substantiv,"die Baustellenverzögerung, -en",sự chậm trễ do công trường,Auf der A3 gibt es Baustellenverzögerungen.,Trên A3 có chậm trễ do công trường.,Verkehr,2026-05-22,B1,horen/2.83,horen,B1;DTZ;Verkehr,
VOC-20260522-935,betreffen,Verb,betraf - hat betroffen,liên quan / ảnh hưởng,Die A7 ist von einem Fahrzeugbrand stark betroffen.,Cao tốc A7 bị ảnh hưởng nặng bởi một vụ cháy xe.,Verkehr,2026-05-22,B1,horen/2.83,horen,B1;DTZ;Verkehr,
VOC-20260522-936,sorgen,Verb,sorgte - hat gesorgt,gây ra / lo lắng,Der Brand sorgt für massive Staus.,Vụ cháy gây ra những đoạn kẹt xe lớn.,Allgemein,2026-05-22,B1,horen/2.83,horen,B1;DTZ;Allgemein,
VOC-20260522-937,überwiegend,Adjektiv,,phần lớn / chủ yếu,Im Westen wird überwiegend sonniges Wetter erwartet.,Phía tây dự kiến phần lớn là thời tiết có nắng.,Wetter,2026-05-22,B1,horen/2.84,horen,B1;DTZ;Wetter,
VOC-20260522-938,Gebiet,Substantiv,"das Gebiet, -e",khu vực / vùng,Schnee wird in höheren Gebieten erwartet.,Tuyết được dự báo ở các vùng cao hơn.,Allgemein,2026-05-22,B1,horen/2.84,horen,B1;DTZ;Allgemein,
VOC-20260522-939,Falschfahrer,Substantiv,"der Falschfahrer, -",xe đi ngược chiều (trên cao tốc),Auf der A96 fährt ein Falschfahrer.,Trên A96 có một xe đi ngược chiều.,Verkehr,2026-05-22,B1,horen/2.85,horen,B1;DTZ;Verkehr,
VOC-20260522-940,melden,Verb,meldete - hat gemeldet,báo cáo / thông báo,Die Polizei meldet einen Falschfahrer.,Cảnh sát báo có xe đi ngược chiều.,Behörde,2026-05-22,B1,horen/2.85,horen,B1;DTZ;Behörde,
VOC-20260522-941,Gewinnspiel,Substantiv,"das Gewinnspiel, -e",trò chơi trúng thưởng,Beim Gewinnspiel kann man eine Reise gewinnen.,Trong trò chơi trúng thưởng có thể thắng một chuyến đi.,Freizeit,2026-05-22,B1,horen/2.86,horen,B1;DTZ;Freizeit,
VOC-20260522-942,Kurzreise,Substantiv,"die Kurzreise, -n",chuyến đi ngắn ngày,Gewinnen Sie eine Kurzreise nach Dortmund.,Hãy thắng một chuyến đi ngắn tới Dortmund.,Reisen,2026-05-22,B1,horen/2.86,horen,B1;DTZ;Reisen,
VOC-20260522-943,Hotelaufenthalt,Substantiv,"der Hotelaufenthalt, -e",kỳ lưu trú khách sạn,Der Preis enthält einen Hotelaufenthalt.,Giải thưởng bao gồm một kỳ lưu trú khách sạn.,Reisen,2026-05-22,B1,horen/2.86,horen,B1;DTZ;Reisen,
VOC-20260522-944,Verwöhnauszeit,Substantiv,"die Verwöhnauszeit, -en",thời gian thư giãn / được chăm sóc,Genießen Sie eine Verwöhnauszeit im Hotel.,Tận hưởng thời gian được chăm sóc tại khách sạn.,Reisen,2026-05-22,B1,horen/2.86,horen,B1;DTZ;Reisen,
VOC-20260522-945,kulinarisch,Adjektiv,,thuộc về ẩm thực,Ein kulinarisches Wochenende ist nicht angeboten.,Một kỳ cuối tuần ẩm thực không được cung cấp.,Freizeit,2026-05-22,B1,horen/2.86,horen,B1;DTZ;Freizeit,
VOC-20260522-946,Ausfall,Substantiv,"der Ausfall, -̈e",việc bị hủy / ngừng,Es geht um den Ausfall der Züge.,Đây là về việc các tàu bị hủy.,Verkehr,2026-05-22,B1,horen/2.87,horen,B1;DTZ;Verkehr,
VOC-20260522-947,Busverbindung,Substantiv,"die Busverbindung, -en",tuyến xe buýt,Eine Busverbindung steht zur Verfügung.,Có một tuyến xe buýt sẵn có.,Verkehr,2026-05-22,B1,horen/2.87,horen,B1;DTZ;Verkehr,
VOC-20260522-948,Horoskop,Substantiv,"das Horoskop, -e",tử vi / lá số tử vi,Hier ist Ihr Horoskop für Montag.,Đây là tử vi của bạn cho thứ hai.,Freizeit,2026-05-22,B1,horen/2.88,horen,B1;DTZ;Freizeit,
VOC-20260522-949,Sportnachricht,Substantiv,"die Sportnachricht, -en",tin tức thể thao,Die Sportnachrichten kommen später.,Tin thể thao đến sau.,Freizeit,2026-05-22,B1,horen/2.88,horen,B1;DTZ;Freizeit,
VOC-20260522-950,astrologisch,Adjektiv,,thuộc chiêm tinh,Astrologische Vorhersagen sind beliebt.,Dự đoán chiêm tinh rất phổ biến.,Freizeit,2026-05-22,B1,horen/2.88,horen,B1;DTZ;Freizeit,
VOC-20260522-951,Vorhersage,Substantiv,"die Vorhersage, -n",dự đoán / dự báo,Die Vorhersage für die Woche ist gut.,Dự đoán cho cả tuần là tốt.,Allgemein,2026-05-22,B1,horen/2.88,horen,B1;DTZ;Allgemein,
VOC-20260522-952,Haltestellenzeit,Substantiv,"die Haltestellenzeit, -en",giờ tại bến (xe buýt),Beachten Sie die neuen Haltestellenzeiten.,Hãy lưu ý giờ tại bến mới.,Verkehr,2026-05-22,B1,horen/2.89,horen,B1;DTZ;Verkehr,
VOC-20260522-953,Personalmangel,Substantiv,"der Personalmangel, kein Plural",thiếu nhân sự,Wegen Personalmangel wurde der Fahrplan angepasst.,Vì thiếu nhân sự lịch chạy đã được điều chỉnh.,Arbeit,2026-05-22,B1,horen/2.89,horen,B1;DTZ;Arbeit,
VOC-20260522-954,Behebung,Substantiv,"die Behebung, -en",việc khắc phục,Auf die Behebung des Personalmangels zu warten ist keine Lösung.,Chờ khắc phục thiếu nhân sự không phải là giải pháp.,Allgemein,2026-05-22,B1,horen/2.89,horen,B1;DTZ;Allgemein,
VOC-20260522-955,veraltet,Adjektiv,,lỗi thời / cũ kỹ,Der alte Fahrplan ist veraltet.,Lịch cũ đã lỗi thời.,Allgemein,2026-05-22,B1,horen/2.89,horen,B1;DTZ;Allgemein,
VOC-20260522-956,Baumaßnahme,Substantiv,"die Baumaßnahme, -n",biện pháp xây dựng / công trình,Wegen Baumaßnahmen ist die Straße gesperrt.,Vì các công trình đường bị đóng.,Verkehr,2026-05-22,B1,horen/2.90,horen,B1;DTZ;Verkehr,
VOC-20260522-957,folgen,Verb,folgte - ist gefolgt,đi theo / tuân theo,Folgen Sie den Umleitungen zum Bahnhof.,Hãy đi theo đường vòng đến nhà ga.,Verkehr,2026-05-22,B1,horen/2.90,horen,B1;DTZ;Verkehr,
VOC-20260522-958,Buchladen,Substantiv,"der Buchladen, -̈",hiệu sách,Im Buchladen gibt es viele Bücher.,Trong hiệu sách có nhiều sách.,Einkauf,2026-05-22,B1,horen/2.91,horen,B1;DTZ;Einkauf,
VOC-20260522-959,Verfügbarkeit,Substantiv,"die Verfügbarkeit, -en",tình trạng có sẵn,Prüfen Sie vorher die Verfügbarkeit.,Hãy kiểm tra trước tình trạng có sẵn.,Einkauf,2026-05-22,B1,horen/2.91,horen,B1;DTZ;Einkauf,
VOC-20260522-960,Lager,Substantiv,"das Lager, -",kho hàng,Bestimmte Bücher sind im Lager nicht verfügbar.,Một số sách không có sẵn trong kho.,Arbeit,2026-05-22,B1,horen/2.91,horen,B1;DTZ;Arbeit,
VOC-20260522-961,Platzmangel,Substantiv,"der Platzmangel, kein Plural",thiếu chỗ / chật chội,Wegen Platzmangel sind einige Bücher nicht verfügbar.,Vì thiếu chỗ một số sách không có sẵn.,Einkauf,2026-05-22,B1,horen/2.91,horen,B1;DTZ;Einkauf,
VOC-20260522-962,Kartenzahlung,Substantiv,"die Kartenzahlung, -en",thanh toán bằng thẻ,Kartenzahlungen werden derzeit nicht akzeptiert.,Hiện không chấp nhận thanh toán bằng thẻ.,Einkauf,2026-05-22,B1,horen/2.92,horen,B1;DTZ;Einkauf,
VOC-20260522-963,bar zahlen,Redemittel,,trả bằng tiền mặt,Sie können bar zahlen oder elektronisch.,Bạn có thể trả bằng tiền mặt hoặc điện tử.,Einkauf,2026-05-22,B1,horen/2.92,horen,B1;DTZ;Einkauf,
VOC-20260522-964,Zahlungsmethode,Substantiv,"die Zahlungsmethode, -n",phương thức thanh toán,Es gibt mehrere Zahlungsmethoden.,Có nhiều phương thức thanh toán.,Einkauf,2026-05-22,B1,horen/2.92,horen,B1;DTZ;Einkauf,
VOC-20260522-965,elektronisch,Adjektiv,,thuộc điện tử,Elektronische Zahlungsmethoden sind beliebt.,Phương thức thanh toán điện tử rất phổ biến.,Technologie,2026-05-22,B1,horen/2.92,horen,B1;DTZ;Technologie,
VOC-20260522-966,akzeptieren,Verb,akzeptierte - hat akzeptiert,chấp nhận,Wir akzeptieren keine Kartenzahlung.,Chúng tôi không chấp nhận thanh toán bằng thẻ.,Einkauf,2026-05-22,B1,horen/2.92,horen,B1;DTZ;Einkauf,
