id,topic,pattern,usage,level,example,compare_with,status,memory_level,first_seen,last_seen,learned_at,next_review,source,tags,notes
GR0001,weil-Satz,weil + Nebensatz,Dùng để nêu lý do,B1,"Ich bleibe zu Hause, weil ich krank bin. Ich ziehe um, weil mein Partner dort lebt.",denn,learning,2,2026-04-05,2026-04-05,,2026-04-07,manual_entry,DTZ|Nebensatz,
GR0002,Zustandspassiv,sein + Partizip II,Diễn tả trạng thái là kết quả của một hành động,B1,Die Tür ist geschlossen.,Vorgangspassiv,new,0,2026-04-05,,,,manual_entry,DTZ|Passiv,
GR0003,Relativsatz,Relativpronomen + Nebensatz,Dùng để bổ nghĩa cho danh từ,B1,"Das ist der Mann, der mir geholfen hat.",Adjektivsatz,learning,2,2026-04-05,2026-04-05,,2026-04-08,manual_entry,DTZ|Satzbau,
GR0004,Höflichkeitsform im Schreiben,Ihre + Nomen,Dùng đại từ sở hữu lịch sự trong thư trang trọng,B1,Mit großem Interesse habe ich Ihre Stellenanzeige gelesen.,ihre,new,0,2026-04-05,,,,dtz_html_2026_04_05_01,DTZ|B1|Schreiben|Brief,
GR0005,Konjunktiv II für höflichen Wunsch,möchte + Infinitiv,Dùng để diễn đạt mong muốn lịch sự trong đơn thư / giao tiếp,B1,Ich möchte mich um diese Stelle bewerben.,wollte / soll,new,0,2026-04-05,,,,dtz_html_2026_04_05_01,DTZ|B1|Schreiben|Modalverb,
GR0006,Konditionalsatz,wenn + Nebensatz,Dùng để nêu điều kiện,B1,"Wenn es terminlich passt, stehe ich Ihnen ab dem 1. August zur Verfügung.",obwohl / damit,new,0,2026-04-05,,,,dtz_html_2026_04_05_01,DTZ|B1|Schreiben|Nebensatz,
GR0007,Verb mit Präposition,sich freuen auf + Akkusativ,Dùng khi mong chờ một việc trong tương lai,B1,Ich freue mich auf die Möglichkeit eines persönlichen Gesprächs.,sich freuen über,new,0,2026-04-05,,,,dtz_html_2026_04_05_01,DTZ|B1|Schreiben|Präposition,
GR0008,Modalverb im höflichen Satz,können + Infinitiv,Dùng để diễn đạt khả năng / cách liên hệ một cách lịch sự,B1,Sie können mich telefonisch erreichen.,dürfen / sollen,new,0,2026-04-05,,,,dtz_html_2026_04_05_01,DTZ|B1|Schreiben|Modalverb,
