lingq_id,term,fragment,hint,status,extended_status,tags,importance,last_studied_correct,first_seen,last_synced,notes
816891490,"die Straßenreinigung","Die Straßenreinigung beginnt um 9 Uhr.","việc làm sạch đường phố",1,0,level:b1;wortart:substantiv;thema:alltag;voc:voc-20260522-633,0,,2026-05-22,2026-05-22,
816891495,"die Strecke","Der Zug wird eine andere Strecke nehmen als üblich.","tuyến đường, đoạn đường",1,0,level:b1;wortart:substantiv;thema:verkehr;voc:voc-20260522-1040,0,,2026-05-22,2026-05-22,
816891499,"die Stromunterbrechung","Eine Stromunterbrechung ist nicht der Grund.","sự cắt điện",1,0,level:b1;wortart:substantiv;thema:technologie;voc:voc-20260522-398,0,,2026-05-22,2026-05-22,
816891506,"die Störung","Keine Störung wird als Grund angegeben.","sự cố/gián đoạn",1,0,level:b1;wortart:substantiv;thema:technologie;voc:voc-20260522-385,0,,2026-05-22,2026-05-22,
816891513,"die Supermarktkette","Die Supermarktkette bietet heute Rabatte an.","chuỗi siêu thị",1,0,level:b1;wortart:substantiv;thema:einkauf;voc:voc-20260522-687,0,,2026-05-22,2026-05-22,
816891519,"die Tageskarte","Jedes Ticket beinhaltet eine Tageskarte für das Bad.","vé ngày",1,0,level:b1;wortart:substantiv;thema:freizeit;voc:voc-20260522-610,0,,2026-05-22,2026-05-22,
816891524,"die Taste","Sie sollen die Taste 3 drücken.","phím bấm",1,0,level:b1;wortart:substantiv;thema:technologie;voc:voc-20260522-350,0,,2026-05-22,2026-05-22,
816891528,"die Teeküche","Das Team trifft sich in der Teeküche.","phòng pha trà công ty",1,0,level:b1;thema:arbeit;wortart:substantiv;voc:voc-20260522-1046,0,,2026-05-22,2026-05-22,
816891543,"die Theateraufführung","Die Theateraufführung wird abgesagt.","buổi diễn kịch",1,0,level:b1;wortart:substantiv;thema:freizeit;voc:voc-20260522-387,0,,2026-05-22,2026-05-22,
816891552,"die Tiefgarage","Die Tiefgarage ist bis 23 Uhr geöffnet.","bãi đỗ xe ngầm",1,0,level:b1;wortart:substantiv;thema:verkehr;voc:voc-20260522-643,0,,2026-05-22,2026-05-22,
816891556,"die Tierarztpraxis","Die Tierarztpraxis Müller sagt Termine ab.","phòng khám thú y",1,0,level:b1;wortart:substantiv;thema:gesundheit;voc:voc-20260522-374,0,,2026-05-22,2026-05-22,
816891564,"die Tombola","Die Tombola findet um 20 Uhr statt.","hội xổ số có thưởng",1,0,level:b1;wortart:substantiv;thema:freizeit;voc:voc-20260522-680,0,,2026-05-22,2026-05-22,
816891570,"die Trainingsmöglichkeit","Alternative Trainingsmöglichkeiten im Aerobic-Bereich.","khả năng tập luyện",1,0,level:b1;wortart:substantiv;thema:freizeit;voc:voc-20260522-1029,0,,2026-05-22,2026-05-22,
816891581,"die Umleitung","Die Umleitungen ignorieren.","đường vòng",1,0,level:b1;wortart:substantiv;thema:verkehr;voc:voc-20260522-1013,0,,2026-05-22,2026-05-22,
816891587,"die Veranstaltung","Der 13. Dezember ist der Tag der Veranstaltung.","sự kiện, buổi tổ chức",1,0,level:b1;wortart:substantiv;thema:freizeit;voc:voc-20260522-671,0,,2026-05-22,2026-05-22,
816891590,"die Verbrennung","Bei Verbrennungen ruft man 144.","vết bỏng",1,0,level:b1;wortart:substantiv;thema:gesundheit;voc:voc-20260522-621,0,,2026-05-22,2026-05-22,
816891602,"die Verkehrsmeldung","Im Radio gibt es eine Verkehrsmeldung.","thông báo giao thông",1,0,level:b1;wortart:substantiv;thema:verkehr;voc:voc-20260522-800,0,,2026-05-22,2026-05-22,
816891607,"die Verkehrsnachricht","Die Verkehrsnachrichten warnen vor Tieren.","tin giao thông",1,0,level:b1;wortart:substantiv;thema:verkehr;voc:voc-20260522-786,0,,2026-05-22,2026-05-22,
816891617,"die Verletzung","Wegen einer Verletzung wird die Aufführung abgesagt.","vết thương/chấn thương",1,0,level:b1;wortart:substantiv;thema:gesundheit;voc:voc-20260522-388,0,,2026-05-22,2026-05-22,
816891624,"die Verlosung","Nehmen Sie an einer Verlosung teil.","buổi rút thăm",1,0,level:b1;wortart:substantiv;thema:freizeit;voc:voc-20260522-1018,0,,2026-05-22,2026-05-22,
816891632,"die Versichertenkarte","Die Versichertenkarte wird im Kontext der Arztpraxis erwähnt.","thẻ bảo hiểm y tế",1,0,level:b1;wortart:substantiv;thema:gesundheit;voc:voc-20260522-261,0,,2026-05-22,2026-05-22,
816891643,"die Versicherung","Die BKK-Versicherung kann die Beiträge nicht abbuchen.","bảo hiểm",1,0,level:b1;wortart:substantiv;thema:behörde;voc:voc-20260522-241,0,,2026-05-22,2026-05-22,
816891648,"die Verspätung","Es kommt zu 20 Minuten Verspätung bei allen S-Bahnen.","sự chậm trễ",1,0,level:b1;wortart:substantiv;thema:verkehr;voc:voc-20260522-289,0,,2026-05-22,2026-05-22,
816891658,"die Vertretung","Bei dringenden Angelegenheiten wird eine Vertretung genannt.","người thay thế/đại diện",1,0,level:b1;thema:arbeit;wortart:substantiv;voc:voc-20260522-293,0,,2026-05-22,2026-05-22,
816891666,"die Verzögerung","Es kann zu Verzögerungen bei der Zustellung von Paketen kommen.","sự chậm trễ",1,0,level:b1;wortart:substantiv;thema:verkehr;voc:voc-20260522-212,0,,2026-05-22,2026-05-22,
816891675,"die Vorbestellung","Geben Sie eine Vorbestellung auf.","đặt trước",1,0,level:b1;wortart:substantiv;thema:einkauf;voc:voc-20260522-1017,0,,2026-05-22,2026-05-22,
816891684,"die Vorführung","Das ist die Uhrzeit für die Vorführung dieses Films.","buổi chiếu/buổi biểu diễn",1,0,level:b1;wortart:substantiv;thema:freizeit;voc:voc-20260522-267,0,,2026-05-22,2026-05-22,
816891692,"die Vorstellung","Die Vorstellung beginnt um 20:30 Uhr.","buổi biểu diễn/buổi chiếu",1,0,level:b1;wortart:substantiv;thema:freizeit;voc:voc-20260522-303,0,,2026-05-22,2026-05-22,
816891699,"die Waldbrandgefahr","Wegen Waldbrandgefahr ist Grillen verboten.","nguy cơ cháy rừng",1,0,level:b1;wortart:substantiv;thema:wetter;voc:voc-20260522-729,0,,2026-05-22,2026-05-22,
816891705,"die Warnung","Eine Warnung der Feuerwehr wurde gesendet.","lời cảnh báo",1,0,level:b1;wortart:substantiv;thema:gesundheit;voc:voc-20260522-622,0,,2026-05-22,2026-05-22,
816891709,"die Wartungsarbeit","Wegen Wartungsarbeiten ist der Zugriff nicht verfügbar.","công việc bảo trì",1,0,level:b1;wortart:substantiv;thema:technologie;voc:voc-20260522-372,0,,2026-05-22,2026-05-22,"[AI-sync 2026-05-22 | VOC-20260522-372]\n\n## Grammar / Notes\nthường dùng số nhiều"
816891716,"die Waschmaschine","Reparatur einer Waschmaschine.","máy giặt",1,0,level:b1;wortart:substantiv;thema:wohnen;voc:voc-20260522-1119,0,,2026-05-22,2026-05-22,
816891725,"die Weiterreise","Die Busse am Ausgang für die Weiterreise nutzen.","chặng đi tiếp",1,0,level:b1;wortart:substantiv;thema:reisen;voc:voc-20260522-1086,0,,2026-05-22,2026-05-22,
816891730,"die Werbeagentur","Frau Müller soll bei der Werbeagentur anrufen.","công ty quảng cáo",1,0,level:b1;thema:arbeit;wortart:substantiv;voc:voc-20260522-1055,0,,2026-05-22,2026-05-22,
816891737,"die Werkstatt","Die Elektrowerkstatt ist vorübergehend geschlossen.","xưởng sửa chữa",1,0,level:b1;thema:arbeit;wortart:substantiv;voc:voc-20260522-232,0,,2026-05-22,2026-05-22,
816891744,"die Wetterbedingung","Die Wetterbedingungen betreffen Regen und Gewitter.","điều kiện thời tiết",1,0,level:b1;wortart:substantiv;thema:wetter;voc:voc-20260522-1010,0,,2026-05-22,2026-05-22,"[AI-sync 2026-05-22 | VOC-20260522-1010]\n\n## Grammar / Notes\nthường ở số nhiều"
816891754,"die Wettervorhersage","In der Wettervorhersage wird ein sonniger Tag erwartet.","dự báo thời tiết",1,0,level:b1;wortart:substantiv;thema:wetter;voc:voc-20260522-223,0,,2026-05-22,2026-05-22,
816891762,"die Willkommensfeier","In Dortmund findet eine Willkommensfeier statt.","lễ chào mừng",1,0,level:b1;wortart:substantiv;thema:gesellschaft;voc:voc-20260522-796,0,,2026-05-22,2026-05-22,
816891767,"die Wohnung","Seine Wohnung befindet sich gegenüber der großen Schule.","căn hộ/nhà ở",1,0,level:b1;wortart:substantiv;thema:wohnen;voc:voc-20260522-250,0,,2026-05-22,2026-05-22,
816891776,"die Wolke","Es gibt am Vormittag wenige Wolken.","đám mây",1,0,level:b1;wortart:substantiv;thema:wetter;voc:voc-20260522-783,0,,2026-05-22,2026-05-22,
816891789,"die Zufahrt","Die Zufahrt zur Ausfahrt 20 kann beeinträchtigt sein.","đường vào",1,0,level:b1;wortart:substantiv;thema:verkehr;voc:voc-20260522-408,0,,2026-05-22,2026-05-22,
816891795,"die Zugverbindung","Die Zugverbindung wurde geändert.","tuyến tàu, kết nối tàu",1,0,level:b1;wortart:substantiv;thema:verkehr;voc:voc-20260522-664,0,,2026-05-22,2026-05-22,
816891800,"die Zustellung","Verzögerungen bei der Zustellung von bis zu zwei Tagen.","việc giao hàng",1,0,level:b1;wortart:substantiv;thema:verkehr;voc:voc-20260522-213,0,,2026-05-22,2026-05-22,
816891811,"die Änderung","Das ist eine Änderung gegenüber der gewohnten Abfahrt.","thay đổi",1,0,level:b1;wortart:substantiv;thema:allgemein;voc:voc-20260522-249,0,,2026-05-22,2026-05-22,
816891816,"die Öffnung","Die Öffnung dauert bis 22 Uhr.","việc mở cửa",1,0,level:b1;wortart:substantiv;thema:alltag;voc:voc-20260522-707,0,,2026-05-22,2026-05-22,
816891822,"die Öffnungszeit","Die Öffnungszeiten variieren am Wochenende.","giờ mở cửa",1,0,level:b1;wortart:substantiv;thema:alltag;voc:voc-20260522-644,0,,2026-05-22,2026-05-22,
816891829,"die Überlastung","Sie nehmen keine neuen Reparaturen wegen einer Überlastung an.","sự quá tải",1,0,level:b1;thema:arbeit;wortart:substantiv;voc:voc-20260522-378,0,,2026-05-22,2026-05-22,
816891835,"die Überweisung","Eine Überweisung wird nicht benötigt.","giấy giới thiệu/chuyển khoản",1,0,level:b1;wortart:substantiv;thema:gesundheit;voc:voc-20260522-339,0,,2026-05-22,2026-05-22,
816891842,Dienstleister,"Die Kontakte externer Dienstleister neu organisieren.","nhà cung cấp dịch vụ",1,0,level:b1;thema:arbeit;wortart:substantiv;voc:voc-20260522-479,0,,2026-05-22,2026-05-22,
816891850,digital,"Digitale Ressourcen online stehen weiterhin zur Verfügung.","số, kỹ thuật số",1,0,level:b1;wortart:adjektiv;thema:technologie;voc:voc-20260522-1021,0,,2026-05-22,2026-05-22,
816891856,diskutieren,"Politiker diskutieren über die Krise.","thảo luận",1,0,wortart:verb;level:b1;thema:gesellschaft;voc:voc-20260522-912,1,,2026-05-22,2026-05-22,
816891866,distanziert,"Große Städte wirken oft unpersönlich und distanziert.","xa cách",1,0,level:b1;wortart:adjektiv;thema:wohnen;voc:voc-20260522-025,0,,2026-05-22,2026-05-22,
816891869,Dokument,"Frau Müller bittet, die fehlenden Dokumente zur Universität zu schicken.","giấy tờ, tài liệu",1,0,level:b1;wortart:substantiv;thema:bildung;voc:voc-20260522-150,1,,2026-05-22,2026-05-22,
816891876,Dokumentation,"Eine Dokumentation über die Arbeit der Bundesregierung.","phim tài liệu",1,0,level:b1;wortart:substantiv;thema:gesellschaft;voc:voc-20260522-592,0,,2026-05-22,2026-05-22,
816891882,dominierend,"Regen ist die dominierende Wetterbedingung.","chiếm ưu thế, chủ đạo",1,0,level:b1;wortart:adjektiv;thema:wetter;voc:voc-20260522-770,0,,2026-05-22,2026-05-22,
816891891,drahtlos,"Die Einrichtung einer drahtlosen Internetverbindung.","không dây",1,0,level:b1;wortart:adjektiv;thema:technologie;voc:voc-20260522-354,0,,2026-05-22,2026-05-22,
816891893,dringend,"Für dringende Fragen zur Mitgliedschaft rufen Sie bitte unseren Kundenservice an.","khẩn cấp",1,0,level:b1;wortart:adjektiv;thema:allgemein;voc:voc-20260522-073,1,,2026-05-22,2026-05-22,
816891901,drücken,"Die Taste 3 drücken.",nhấn/bấm,1,0,wortart:verb;level:b1;thema:technologie;voc:voc-20260522-351,1,,2026-05-22,2026-05-22,"[AI-sync 2026-05-22 | VOC-20260522-351]\n\n## Collocations\n- im Vergleich zu (so với)"
816891907,durchführen,"Eine Vertretung wird die Prüfung durchführen.","thực hiện/tổ chức",1,0,wortart:verb;level:b1;thema:arbeit;voc:voc-20260522-370,1,,2026-05-22,2026-05-22,"[AI-sync 2026-05-22 | VOC-20260522-370]\n\n## Grammar / Notes\ntrennbar"
816891912,effektiv,"LinguaMax steht für schnelles und effektives Lernen verschiedener Sprachen.","hiệu quả",1,0,level:b1;wortart:adjektiv;thema:bildung;voc:voc-20260522-155,0,,2026-05-22,2026-05-22,
816891913,Einblick,"Sie erhalten wichtige Einblicke in das Thema.","cái nhìn / sự hiểu biết",1,0,level:b1;wortart:substantiv;thema:bildung;voc:voc-20260522-871,0,,2026-05-22,2026-05-22,
816891921,Eindruck,"Die Reise hat einen bleibenden Eindruck hinterlassen.","ấn tượng",1,0,level:b1;wortart:substantiv;thema:reisen;voc:voc-20260522-837,2,,2026-05-22,2026-05-22,
816891931,einfahren,"Auf Gleis 10 wird der Regionalexpress 678 einfahren.","vào ga",1,0,wortart:verb;level:b1;thema:verkehr;voc:voc-20260522-248,0,,2026-05-22,2026-05-22,"[AI-sync 2026-05-22 | VOC-20260522-248]\n\n## Grammar / Notes\ntrennbar"
816891937,Eingang,"Über einen separaten Eingang im Erdgeschoss.","lối vào",1,0,level:b1;wortart:substantiv;thema:wohnen;voc:voc-20260522-438,2,,2026-05-22,2026-05-22,
816891946,einholen,"Aktuelle Informationen einholen.","thu thập, lấy được",1,0,wortart:verb;level:b1;thema:arbeit;voc:voc-20260522-475,0,,2026-05-22,2026-05-22,"[AI-sync 2026-05-22 | VOC-20260522-475]\n\n## Grammar / Notes\ntrennbar"
816891952,einkaufen,"An welchem Tag kann man am längsten einkaufen?","đi mua sắm",1,0,wortart:verb;level:b1;thema:einkauf;voc:voc-20260522-562,1,,2026-05-22,2026-05-22,"[AI-sync 2026-05-22 | VOC-20260522-562]\n\n## Grammar / Notes\ntrennbar"
816891959,Einkaufsgutschein,"Es gibt Einkaufsgutscheine zu gewinnen.","phiếu mua hàng",1,0,level:b1;wortart:substantiv;thema:einkauf;voc:voc-20260522-884,0,,2026-05-22,2026-05-22,
816891964,Einkaufszentrum,"Der Aufzug im Westflügel des Einkaufszentrums ist außer Betrieb.","trung tâm mua sắm",1,0,level:b1;wortart:substantiv;thema:einkauf;voc:voc-20260522-182,0,,2026-05-22,2026-05-22,"[AI-sync 2026-05-22 | VOC-20260522-182]\n\n## Grammar / Notes\nPlural unregelmäßig"
816891969,einliefern,"Die Hauptärztin wurde ins Krankenhaus eingeliefert.","đưa vào (bệnh viện)",1,0,wortart:verb;level:b1;thema:gesundheit;voc:voc-20260522-376,0,,2026-05-22,2026-05-22,"[AI-sync 2026-05-22 | VOC-20260522-376]\n\n## Grammar / Notes\ntrennbar"
816891973,Einnahme,"Es gibt Anweisungen für die Einnahme von Schlafpil.","việc dùng (thuốc) / sử dụng",1,0,level:b1;wortart:substantiv;thema:gesundheit;voc:voc-20260522-809,0,,2026-05-22,2026-05-22,
816891979,einnehmen,"Wie sollen Erwachsene das Medikament einnehmen?","uống (thuốc), nhận",1,0,wortart:verb;level:b1;thema:gesundheit;voc:voc-20260522-595,0,,2026-05-22,2026-05-22,"[AI-sync 2026-05-22 | VOC-20260522-595]\n\n## Grammar / Notes\ntrennbar"
816891984,einplanen,"Zusätzliche Reisezeit einplanen.","dự tính, lập kế hoạch sẵn",1,0,wortart:verb;level:b1;thema:allgemein;voc:voc-20260522-1014,0,,2026-05-22,2026-05-22,"[AI-sync 2026-05-22 | VOC-20260522-1014]\n\n## Grammar / Notes\ntrennbar"
816891989,Einrichtung,"Informationen zur Einrichtung des Internetzugangs.","việc cài đặt, thiết bị",1,0,level:b1;wortart:substantiv;thema:technologie;voc:voc-20260522-502,1,,2026-05-22,2026-05-22,
816891994,Einsatzort,"Meiden Sie den Einsatzort der Feuerwehr.","hiện trường (làm nhiệm vụ)",1,0,level:b1;wortart:substantiv;thema:behörde;voc:voc-20260522-862,0,,2026-05-22,2026-05-22,
816892002,einschalten,"Schalten Sie die Klimaanlage ein.","bật / khởi động",1,0,wortart:verb;level:b1;thema:wohnen;voc:voc-20260522-977,0,,2026-05-22,2026-05-22,
816892007,einspringen,"Falls sie morgen einspringen kann.","thay ca, hỗ trợ thay",1,0,wortart:verb;level:b1;thema:arbeit;voc:voc-20260522-509,0,,2026-05-22,2026-05-22,"[AI-sync 2026-05-22 | VOC-20260522-509]\n\n## Grammar / Notes\ntrennbar; sein"
816892016,einsteigen,"In der Mitte des Zuges einsteigen ist falsch.","lên (xe/tàu)",1,0,wortart:verb;level:b1;thema:verkehr;voc:voc-20260522-133,0,,2026-05-22,2026-05-22,"[AI-sync 2026-05-22 | VOC-20260522-133]\n\n## Grammar / Notes\ntrennbar"
816892021,Einstieg,"Ein späterer Einstieg ist nicht möglich.","việc bắt đầu, tham gia vào",1,0,level:b1;wortart:substantiv;thema:bildung;voc:voc-20260522-057,0,,2026-05-22,2026-05-22,
816892029,Eintritt,"Der Eintritt zur Abteilung erfolgt über einen separaten Eingang.","việc vào, vé vào",1,0,level:b1;wortart:substantiv;thema:freizeit;voc:voc-20260522-441,1,,2026-05-22,2026-05-22,
816892034,Einwohner,"Die Einwohner sollen ihre Fenster schließen.","cư dân",1,0,level:b1;wortart:substantiv;thema:wohnen;voc:voc-20260522-864,2,,2026-05-22,2026-05-22,
816892044,Eisenbahnbrücke,"Eine neue Eisenbahnbrücke wird gebaut.","cầu đường sắt",1,0,level:b1;wortart:substantiv;thema:verkehr;voc:voc-20260522-905,0,,2026-05-22,2026-05-22,
816892048,Eiweiß,"Mageres Eiweiß ist gut für die Gesundheit.","protein / lòng trắng trứng",1,0,level:b1;wortart:substantiv;thema:gesundheit;voc:voc-20260522-917,0,,2026-05-22,2026-05-22,
816892056,elektronisch,"Elektronische Zahlungsmethoden sind beliebt.","thuộc điện tử",1,0,level:b1;wortart:adjektiv;thema:technologie;voc:voc-20260522-965,0,,2026-05-22,2026-05-22,
816892064,empfangen,"Maxine Lehmann zusammen mit dem Team in der Teeküche empfangen.","đón tiếp",1,0,wortart:verb;level:b1;thema:arbeit;voc:voc-20260522-1049,1,,2026-05-22,2026-05-22,"[AI-sync 2026-05-22 | VOC-20260522-1049]\n\n## Grammar / Notes\nuntrennbar, bất quy tắc"
816892071,empfehlen,"Es wird empfohlen, alternative Routen zu wählen.","khuyến nghị/khuyên",1,0,wortart:verb;level:b1;thema:allgemein;voc:voc-20260522-409,1,,2026-05-22,2026-05-22,
816892077,Empfehlung,"Es wird keine Empfehlung gegeben.","lời khuyên, gợi ý",1,0,level:b1;wortart:substantiv;thema:allgemein;voc:voc-20260522-451,1,,2026-05-22,2026-05-22,
816892082,empfinden,"Viele Menschen empfinden den Geräuschpegel als störend.","cảm nhận",1,0,wortart:verb;level:b1;thema:allgemein;voc:voc-20260522-019,1,,2026-05-22,2026-05-22,"[AI-sync 2026-05-22 | VOC-20260522-019]\n\n## Grammar / Notes\noft mit ALS + Adjektiv\n\n## Collocations\n- etwas als störend empfinden (cảm thấy ... gây phiền)"
816892086,enden,"Die Frist endet am Montag.","kết thúc",1,0,wortart:verb;level:b1;thema:allgemein;voc:voc-20260522-672,1,,2026-05-22,2026-05-22,"[AI-sync 2026-05-22 | VOC-20260522-672]\n\n## Collocations\n- dürfen kein(e) + N + Verb (không được phép làm... (cấm))"
816892090,endgültig,"Der 15. Juli ist das endgültige Datum.","cuối cùng, dứt khoát",1,0,level:b1;wortart:adjektiv;thema:allgemein;voc:voc-20260522-434,1,,2026-05-22,2026-05-22,
816892098,Energiekosten,"Wir müssen die Energiekosten im Blick behalten.","chi phí năng lượng",1,0,level:b1;wortart:substantiv;thema:wohnen;voc:voc-20260522-105,0,,2026-05-22,2026-05-22,"[AI-sync 2026-05-22 | VOC-20260522-105]\n\n## Grammar / Notes\nchỉ dùng số nhiều"
816892107,entfallen,"Die Haltestelle am Rathaus entfällt.","bị bỏ, bị hủy",1,0,wortart:verb;level:b1;thema:allgemein;voc:voc-20260522-448,0,,2026-05-22,2026-05-22,"[AI-sync 2026-05-22 | VOC-20260522-448]\n\n## Grammar / Notes\nsein"
816892114,entgegenkommen,"Auf der A4 kommt Ihnen ein Fahrzeug entgegen.","đi ngược chiều / đến từ phía đối diện",1,0,wortart:verb;level:b1;thema:verkehr;voc:voc-20260522-887,0,,2026-05-22,2026-05-22,
816892117,entgegennehmen,"Leider können wir Ihren Anruf gerade nicht persönlich entgegennehmen.","tiếp nhận (cuộc gọi)",1,0,wortart:verb;level:b1;thema:freizeit;voc:voc-20260522-067,0,,2026-05-22,2026-05-22,"[AI-sync 2026-05-22 | VOC-20260522-067]\n\n## Grammar / Notes\ntrennbar"
816892121,entsprechen,"Diese Option entspricht nicht dem Angebot.","phù hợp với",1,0,wortart:verb;level:b1;thema:allgemein;voc:voc-20260522-281,1,,2026-05-22,2026-05-22,"[AI-sync 2026-05-22 | VOC-20260522-281]\n\n## Grammar / Notes\nđi với Dativ"
816892133,Erdgeschoss,"Ein separater Eingang im Erdgeschoss.","tầng trệt",1,0,level:b1;wortart:substantiv;thema:wohnen;voc:voc-20260522-439,0,,2026-05-22,2026-05-22,
816892137,Ereignis,"Politische Ereignisse werden nicht angesprochen.","sự kiện",1,0,level:b1;wortart:substantiv;thema:gesellschaft;voc:voc-20260522-470,1,,2026-05-22,2026-05-22,
816892145,erfolgen,"Der Eintritt erfolgt über einen separaten Eingang.","diễn ra, được tiến hành",1,0,wortart:verb;level:b1;thema:allgemein;voc:voc-20260522-442,1,,2026-05-22,2026-05-22,"[AI-sync 2026-05-22 | VOC-20260522-442]\n\n## Grammar / Notes\nsein"
816892163,erforderlich,"Die Zustimmung eines Arztes ist erforderlich.","cần thiết, bắt buộc",1,0,level:b1;wortart:adjektiv;thema:allgemein;voc:voc-20260522-599,2,,2026-05-22,2026-05-22,
816892169,erfragen,"Den aktuellen Stand erfragen.","hỏi để biết",1,0,wortart:verb;level:b1;thema:allgemein;voc:voc-20260522-1057,0,,2026-05-22,2026-05-22,"[AI-sync 2026-05-22 | VOC-20260522-1057]\n\n## Grammar / Notes\nuntrennbar"
816892172,erhalten,"Sie sollen einen Brief erhalten.","nhận được",1,0,wortart:verb;level:b1;thema:allgemein;voc:voc-20260522-402,3,,2026-05-22,2026-05-22,
816892179,erhältlich,"Welche Artikel sind heute bei einer Sonderaktion erhältlich?","có sẵn để mua",1,0,level:b1;wortart:adjektiv;thema:einkauf;voc:voc-20260522-317,0,,2026-05-22,2026-05-22,
816892185,Erinnerung,"Hier ist Ihre Erinnerung für das kommende Semester.","lời nhắc, ký ức",1,0,level:b1;wortart:substantiv;thema:bildung;voc:voc-20260522-054,2,,2026-05-22,2026-05-22,
816892199,erlaubt,"Grillen ist nur an bestimmten Plätzen erlaubt.","được phép",1,0,level:b1;wortart:adjektiv;thema:allgemein;voc:voc-20260522-733,2,,2026-05-22,2026-05-22,"[AI-sync 2026-05-22 | VOC-20260522-733]\n\n## Grammar / Notes\nphân từ II của erlauben"
816892206,ermäßigt,"Obst und Gemüse werden zu reduzierten Preisen, aber nicht zum halben Preis angeboten.","được giảm giá",1,0,level:b1;wortart:adjektiv;thema:einkauf;voc:voc-20260522-192,0,,2026-05-22,2026-05-22,"[AI-sync 2026-05-22 | VOC-20260522-192]\n\n## Grammar / Notes\nPartizip II als Adjektiv"
816892219,erneuerbar,"Maßnahmen zur Entwicklung erneuerbarer Energiequellen.","có thể tái tạo",1,0,level:b1;wortart:adjektiv;thema:gesellschaft;voc:voc-20260522-220,0,,2026-05-22,2026-05-22,
816892229,erneuern,"Die Bremsen wurden erneuert.","đổi mới, thay mới",1,0,wortart:verb;level:b1;thema:allgemein;voc:voc-20260522-1110,0,,2026-05-22,2026-05-22,"[AI-sync 2026-05-22 | VOC-20260522-1110]\n\n## Grammar / Notes\nuntrennbar"
816892235,erreichbar,"Geschäfte, Arbeit und Freizeitangebote sind schnell erreichbar.","có thể tới được, dễ tới",1,0,level:b1;wortart:adjektiv;thema:allgemein;voc:voc-20260522-024,0,,2026-05-22,2026-05-22,"[AI-sync 2026-05-22 | VOC-20260522-024]\n\n## Collocations\n- schnell erreichbar sein (dễ tới nhanh)"
816892243,erreichen,"Die U-Bahn ist die schnellste Option, um den Hauptbahnhof zu erreichen.","đạt được/đến được",1,0,wortart:verb;level:b1;thema:verkehr;voc:voc-20260522-292,3,,2026-05-22,2026-05-22,
816892248,errichten,"Bauarbeiten zur Errichtung einer neuen Eisenbahnbrücke.","xây dựng, dựng lên",1,0,wortart:verb;level:b1;thema:wohnen;voc:voc-20260522-489,0,,2026-05-22,2026-05-22,
816892255,Ersatzhaltestelle,"Welche beiden Ersatzhaltestellen werden empfohlen?","trạm dừng thay thế",1,0,level:b1;wortart:substantiv;thema:verkehr;voc:voc-20260522-445,0,,2026-05-22,2026-05-22,
816892261,Ersatztermin,"Es wird keinen Ersatztermin geben.","lịch thay thế",1,0,level:b1;wortart:substantiv;thema:allgemein;voc:voc-20260522-560,0,,2026-05-22,2026-05-22,
816892270,Ersatzverkehr,"Busse werden als Ersatzverkehr eingesetzt, die die Route übernehmen.","phương tiện thay thế",1,0,level:b1;wortart:substantiv;thema:verkehr;voc:voc-20260522-044,0,,2026-05-22,2026-05-22,
816892274,ersetzen,"Im Auto wurden die Bremsbeläge ersetzt.","thay thế",1,0,wortart:verb;level:b1;thema:verkehr;voc:voc-20260522-239,1,,2026-05-22,2026-05-22,
816892281,Erwachsene,"Erwachsene sollen das Medikament mit Wasser einnehmen.","người lớn",1,0,level:b1;wortart:substantiv;thema:gesundheit;voc:voc-20260522-596,1,,2026-05-22,2026-05-22,
816892286,erwarten,"Die Zuschauer können heute sonniges Wetter erwarten.","mong đợi/dự kiến",1,0,wortart:verb;level:b1;thema:allgemein;voc:voc-20260522-226,2,,2026-05-22,2026-05-22,
816892291,erwähnen,"Im Text wird kein Park erwähnt.","đề cập đến",1,0,wortart:verb;level:b1;thema:allgemein;voc:voc-20260522-253,0,,2026-05-22,2026-05-22,
816892300,Erwärmung,"Im Osten wird eine Erwärmung erwartet.","sự ấm lên",1,0,level:b1;wortart:substantiv;thema:wetter;voc:voc-20260522-853,0,,2026-05-22,2026-05-22,
816892307,"es handelt sich um","Es handelt sich um eine Arztpraxis.","đây là, đó là về",1,0,level:b1;thema:allgemein;wortart:redemittel;voc:voc-20260522-603,0,,2026-05-22,2026-05-22,
816892311,explizit,"12 Uhr wird nicht explizit erwähnt.","rõ ràng, dứt khoát",1,0,level:b1;wortart:adjektiv;thema:allgemein;voc:voc-20260522-651,0,,2026-05-22,2026-05-22,
816892314,extern,"Externe Dienstleister neu organisieren.","bên ngoài, ngoài công ty",1,0,level:b1;thema:arbeit;wortart:adjektiv;voc:voc-20260522-480,0,,2026-05-22,2026-05-22,
816892316,Fahrbahn,"Die Fahrbahn ist wieder frei.","làn đường / mặt đường",1,0,level:b1;wortart:substantiv;thema:verkehr;voc:voc-20260522-850,0,,2026-05-22,2026-05-22,
816892324,Fahrgast,"Sehr geehrte Fahrgäste, auf Gleis 4 fährt der ICE 577 nach Köln ein.","hành khách",1,0,level:b1;wortart:substantiv;thema:verkehr;voc:voc-20260522-029,0,,2026-05-22,2026-05-22,"[AI-sync 2026-05-22 | VOC-20260522-029]\n\n## Grammar / Notes\nPlural mit Umlaut"
