lingq_id,term,fragment,hint,status,extended_status,tags,importance,last_studied_correct,first_seen,last_synced,notes
816894176,"sich anmelden","Sie haben noch bis zum 31. Januar die Möglichkeit, sich anzumelden.","đăng ký",1,0,wortart:verb;level:b1;thema:freizeit;voc:voc-20260522-049,0,,2026-05-22,2026-05-22,"[AI-sync 2026-05-22 | VOC-20260522-049]\n\n## Grammar / Notes\ntrennbar, reflexiv"
816894187,"sich aufhalten","Kinder sollen sich am Mittag zu Hause aufhalten.","lưu lại, ở",1,0,wortart:verb;level:b1;thema:alltag;voc:voc-20260522-605,0,,2026-05-22,2026-05-22,"[AI-sync 2026-05-22 | VOC-20260522-605]\n\n## Grammar / Notes\ntách được; phản thân"
816894195,"sich austauschen","Sie möchte sich mit Frau Schmidt austauschen.","trao đổi, bàn bạc",1,0,wortart:verb;level:b1;thema:allgemein;voc:voc-20260522-483,0,,2026-05-22,2026-05-22,"[AI-sync 2026-05-22 | VOC-20260522-483]\n\n## Grammar / Notes\nreflexiv; trennbar"
816894202,"sich befinden","Die Wagen der ersten Klasse befinden sich ganz nach vorne.","nằm ở, ở vị trí",1,0,wortart:verb;level:b1;thema:verkehr;voc:voc-20260522-033,0,,2026-05-22,2026-05-22,"[AI-sync 2026-05-22 | VOC-20260522-033]\n\n## Grammar / Notes\nreflexiv: sich + Position"
816894209,"sich beziehen","23 Uhr bezieht sich auf die Tiefgarage.","liên quan đến",1,0,wortart:verb;level:b1;thema:allgemein;voc:voc-20260522-646,0,,2026-05-22,2026-05-22,"[AI-sync 2026-05-22 | VOC-20260522-646]\n\n## Grammar / Notes\nphản thân"
816894218,"sich beziehen auf","Er bezieht sich dabei auf das von dem Kunden genannte Update.","liên quan đến, đề cập đến",1,0,level:b1;thema:allgemein;wortart:redemittel;voc:voc-20260522-1219,0,,2026-05-22,2026-05-22,"[AI-sync 2026-05-22 | VOC-20260522-1219]\n\n## Grammar / Notes\nsich beziehen auf + Akk."
816894229,"sich interessieren für","Mein Sohn interessiert sich total für Baustellen.","quan tâm đến",1,0,wortart:verb;level:b1;thema:allgemein;voc:voc-20260522-1107,0,,2026-05-22,2026-05-22,"[AI-sync 2026-05-22 | VOC-20260522-1107]\n\n## Grammar / Notes\nphản thân, đi với für"
816894236,"sich kümmern","Die Werkstatt hat sich um die Ersatzteile gekümmert.","lo liệu/chăm sóc",1,0,wortart:verb;level:b1;thema:alltag;voc:voc-20260522-358,0,,2026-05-22,2026-05-22,"[AI-sync 2026-05-22 | VOC-20260522-358]\n\n## Grammar / Notes\nreflexive, đi với um + Akk"
816894245,"sich melden","Das Büro wird sich telefonisch melden.","liên lạc/báo lại",1,0,wortart:verb;level:b1;thema:alltag;voc:voc-20260522-400,0,,2026-05-22,2026-05-22,"[AI-sync 2026-05-22 | VOC-20260522-400]\n\n## Grammar / Notes\nreflexive"
816894250,"sich treffen","Sie treffen sich nicht um 10 Uhr, sondern um 12 Uhr im Café Sonnenschein.","gặp nhau",1,0,wortart:verb;level:b1;thema:familie;voc:voc-20260522-187,0,,2026-05-22,2026-05-22,"[AI-sync 2026-05-22 | VOC-20260522-187]\n\n## Grammar / Notes\nreflexiv"
816894258,"sich verletzen","Die Hauptdarstellerin hat sich verletzt.","tự làm bị thương",1,0,wortart:verb;level:b1;thema:gesundheit;voc:voc-20260522-389,0,,2026-05-22,2026-05-22,"[AI-sync 2026-05-22 | VOC-20260522-389]\n\n## Grammar / Notes\nreflexive"
816894266,"sich verspäten","Der Zug nach Salzburg verspätet sich heute.","đến trễ, bị muộn",1,0,wortart:verb;level:b1;thema:verkehr;voc:voc-20260522-695,0,,2026-05-22,2026-05-22,"[AI-sync 2026-05-22 | VOC-20260522-695]\n\n## Grammar / Notes\nphản thân"
816894277,"sich verzögern","Die Reparatur hat sich verzögert.","bị chậm trễ",1,0,wortart:verb;level:b1;thema:allgemein;voc:voc-20260522-363,0,,2026-05-22,2026-05-22,"[AI-sync 2026-05-22 | VOC-20260522-363]\n\n## Grammar / Notes\nreflexive"
816894287,"sich vorbereiten","Was wird empfohlen, um sich vorzubereiten?","chuẩn bị",1,0,wortart:verb;level:b1;thema:allgemein;voc:voc-20260522-1012,0,,2026-05-22,2026-05-22,"[AI-sync 2026-05-22 | VOC-20260522-1012]\n\n## Grammar / Notes\ntrennbar, phản thân"
816894292,"sich vorstellen","Klara Schulz stellt sich im Text vor.","tự giới thiệu",1,0,wortart:verb;level:b1;thema:alltag;voc:voc-20260522-263,0,,2026-05-22,2026-05-22,"[AI-sync 2026-05-22 | VOC-20260522-263]\n\n## Grammar / Notes\nreflexive, trennbar"
816894301,"sich wenden","Sich an die Mitarbeiter im Café wenden.","tìm đến, liên hệ",1,0,wortart:verb;level:b1;thema:alltag;voc:voc-20260522-413,0,,2026-05-22,2026-05-22,"[AI-sync 2026-05-22 | VOC-20260522-413]\n\n## Grammar / Notes\nreflexiv; an + Akk"
816894310,"sich wenden an","Für Fragen wenden Sie sich gerne an die Rezeption.","liên hệ với, tìm đến",1,0,wortart:verb;level:b1;thema:allgemein;voc:voc-20260522-093,0,,2026-05-22,2026-05-22,"[AI-sync 2026-05-22 | VOC-20260522-093]\n\n## Grammar / Notes\nreflexiv: sich wenden an + Akk."
816894314,Sicherheitsgrund,"Einige Zugverbindungen werden aus Sicherheitsgründen früher enden.","lý do an toàn",1,0,level:b1;wortart:substantiv;thema:verkehr;voc:voc-20260522-097,0,,2026-05-22,2026-05-22,"[AI-sync 2026-05-22 | VOC-20260522-097]\n\n## Grammar / Notes\nPlural mit Umlaut; thường dùng aus Sicherheitsgründen"
816894326,sichern,"Was wird empfohlen, um die besten Plätze zu sichern?","đảm bảo, giữ chỗ",1,0,wortart:verb;level:b1;thema:freizeit;voc:voc-20260522-998,1,,2026-05-22,2026-05-22,
816894330,sichten,"Radfahrer wurden auf der Autobahn gesichtet.","phát hiện / nhìn thấy",1,0,wortart:verb;level:b1;thema:verkehr;voc:voc-20260522-880,0,,2026-05-22,2026-05-22,
816894337,Silvester,"Wir feiern Silvester mit einer großen Party.","đêm giao thừa",1,0,level:b1;wortart:substantiv;thema:freizeit;voc:voc-20260522-848,0,,2026-05-22,2026-05-22,
816894343,Silvesterparty,"Auf der Silvesterparty kann man Preise gewinnen.","tiệc đêm Giao thừa",1,0,level:b1;wortart:substantiv;thema:freizeit;voc:voc-20260522-530,0,,2026-05-22,2026-05-22,
816894349,sinken,"Die Temperatur wird voraussichtlich sinken.","giảm, hạ xuống",1,0,wortart:verb;level:b1;thema:wetter;voc:voc-20260522-1052,1,,2026-05-22,2026-05-22,"[AI-sync 2026-05-22 | VOC-20260522-1052]\n\n## Grammar / Notes\nbất quy tắc, đi với sein"
816894361,Sitzplatz,"Nehmen Sie Ihren Sitzplatz rechtzeitig ein.","chỗ ngồi",1,0,level:b1;wortart:substantiv;thema:freizeit;voc:voc-20260522-988,0,,2026-05-22,2026-05-22,
816894369,sofort,"Es geht nicht um eine sofortige Behandlung.","ngay lập tức",1,0,level:b1;thema:allgemein;wortart:adverb;voc:voc-20260522-337,3,,2026-05-22,2026-05-22,
816894379,Sommerferien,"Während der Sommerferien.","kỳ nghỉ hè",1,0,level:b1;wortart:substantiv;thema:bildung;voc:voc-20260522-575,0,,2026-05-22,2026-05-22,"[AI-sync 2026-05-22 | VOC-20260522-575]\n\n## Grammar / Notes\nPluraletantum"
816894386,Sondersendung,"Eine Sondersendung zur Bankenkrise.","chương trình đặc biệt",1,0,level:b1;wortart:substantiv;thema:gesellschaft;voc:voc-20260522-492,0,,2026-05-22,2026-05-22,
816894396,Sonne,"Im Westen scheint hauptsächlich die Sonne.","mặt trời",1,0,level:b1;wortart:substantiv;thema:wetter;voc:voc-20260522-929,3,,2026-05-22,2026-05-22,
816894405,Sonnenschein,"In Andalusien sind bis zu 35 Grad und strahlender Sonnenschein möglich.","ánh nắng",1,0,level:b1;wortart:substantiv;thema:wetter;voc:voc-20260522-063,1,,2026-05-22,2026-05-22,"[AI-sync 2026-05-22 | VOC-20260522-063]\n\n## Grammar / Notes\nthường không có số nhiều"
816894409,sonnig,"Heute wird sonniges Wetter mit wenig Wind erwartet.","có nắng/nắng đẹp",1,0,level:b1;wortart:adjektiv;thema:wetter;voc:voc-20260522-224,1,,2026-05-22,2026-05-22,
816894422,Sonntagsöffnung,"Die Sonntagsöffnung ändert sich nicht.","việc mở cửa Chủ Nhật",1,0,level:b1;wortart:substantiv;thema:einkauf;voc:voc-20260522-444,0,,2026-05-22,2026-05-22,
816894428,sorgen,"Der Brand sorgt für massive Staus.","gây ra / lo lắng",1,0,wortart:verb;level:b1;thema:allgemein;voc:voc-20260522-936,3,,2026-05-22,2026-05-22,
816894436,Sortiment,"Sie haben keine Spezial-Farbe im Sortiment.","danh mục, chủng loại",1,0,level:b1;wortart:substantiv;thema:einkauf;voc:voc-20260522-485,0,,2026-05-22,2026-05-22,
816894440,"sowohl als auch","Sowohl morgen als auch am Sonntag scheint die Sonne.","cả ... lẫn",1,0,level:b1;thema:allgemein;wortart:konjunktion;voc:voc-20260522-785,0,,2026-05-22,2026-05-22,"[AI-sync 2026-05-22 | VOC-20260522-785]\n\n## Grammar / Notes\nliên từ kép"
816894448,Speisemöglichkeit,"Das Restaurant wird als alternative Speisemöglichkeit empfohlen.","nơi ăn uống",1,0,level:b1;wortart:substantiv;thema:einkauf;voc:voc-20260522-456,0,,2026-05-22,2026-05-22,
816894454,Speisewagen,"Der Speisewagen befindet sich in Wagen 7.","toa ăn uống",1,0,level:b1;wortart:substantiv;thema:verkehr;voc:voc-20260522-108,0,,2026-05-22,2026-05-22,
816894461,sperren,"Die A6 ist wegen Bauarbeiten gesperrt.","đóng, chặn",1,0,wortart:verb;level:b1;thema:verkehr;voc:voc-20260522-487,0,,2026-05-22,2026-05-22,
816894466,Spezialität,"Es gibt Stände mit lokalen Spezialitäten.","đặc sản",1,0,level:b1;wortart:substantiv;thema:einkauf;voc:voc-20260522-206,0,,2026-05-22,2026-05-22,
816894472,speziell,"Fahrzeuge mit spezieller Genehmigung.","đặc biệt, riêng biệt",1,0,level:b1;wortart:adjektiv;thema:allgemein;voc:voc-20260522-424,1,,2026-05-22,2026-05-22,
816894486,spontan,"Spontan am Tag des Films ins Kino gehen.","tự phát, ngẫu hứng",1,0,level:b1;wortart:adjektiv;thema:freizeit;voc:voc-20260522-999,1,,2026-05-22,2026-05-22,"[AI-sync 2026-05-22 | VOC-20260522-999]\n\n## Collocations\n- etwas spontan erledigen (làm việc gì đó tự phát)"
816894494,Sportnachricht,"Die Sportnachrichten kommen später.","tin tức thể thao",1,0,level:b1;wortart:substantiv;thema:freizeit;voc:voc-20260522-949,0,,2026-05-22,2026-05-22,
816894504,Sporttasche,"Eine gefundene Sporttasche.","túi đồ thể thao",1,0,level:b1;wortart:substantiv;thema:freizeit;voc:voc-20260522-564,0,,2026-05-22,2026-05-22,
816894513,Sprachenberatung,"Die Nummer ist nicht für die Sprachenberatung.","tư vấn ngoại ngữ",1,0,level:b1;wortart:substantiv;thema:bildung;voc:voc-20260522-544,0,,2026-05-22,2026-05-22,
816894520,Sprachkurs,"Wenn Sie an einem unserer Sprachkurse teilnehmen möchten, ist der 31. Januar das letzte Datum zur Anmeldung.","khóa học ngôn ngữ",1,0,level:b1;wortart:substantiv;thema:bildung;voc:voc-20260522-053,0,,2026-05-22,2026-05-22,
816894527,Sprechzeit,"Leider rufen Sie außerhalb unserer Sprechzeiten an.","giờ khám",1,0,level:b1;wortart:substantiv;thema:gesundheit;voc:voc-20260522-098,0,,2026-05-22,2026-05-22,
816894532,spätestens,"Die Reparatur ist spätestens morgen fertig.","muộn nhất là",1,0,level:b1;thema:allgemein;wortart:adverb;voc:voc-20260522-1123,1,,2026-05-22,2026-05-22,
816894538,Stadtpark,"Ein Café im Stadtpark.","công viên thành phố",1,0,level:b1;wortart:substantiv;thema:freizeit;voc:voc-20260522-457,0,,2026-05-22,2026-05-22,
816894549,Stadtteil,"Die Einwohner des Stadtteils werden informiert.","khu phố / quận",1,0,level:b1;wortart:substantiv;thema:wohnen;voc:voc-20260522-866,1,,2026-05-22,2026-05-22,
816894555,Stadtzentrum,"Am oberen Ausgang des Stadtzentrums.","trung tâm thành phố",1,0,level:b1;wortart:substantiv;thema:wohnen;voc:voc-20260522-571,0,,2026-05-22,2026-05-22,
816894566,starten,"Die Busse starten am Hauptbahnhof.","khởi hành, bắt đầu",1,0,wortart:verb;level:b1;thema:verkehr;voc:voc-20260522-568,1,,2026-05-22,2026-05-22,"[AI-sync 2026-05-22 | VOC-20260522-568]\n\n## Grammar / Notes\nsein"
816894571,statt,"Der Zug fährt um 16:10 statt um 15:45.","thay vì, thay cho",1,0,level:b1;wortart:präposition;thema:allgemein;voc:voc-20260522-697,3,,2026-05-22,2026-05-22,"[AI-sync 2026-05-22 | VOC-20260522-697]\n\n## Grammar / Notes\nđi với Gen."
816894579,stattdessen,"Die Fahrgäste sollen stattdessen den Zug S567 nehmen.","thay vào đó",1,0,level:b1;thema:allgemein;wortart:adverb;voc:voc-20260522-417,2,,2026-05-22,2026-05-22,
816894588,stattfinden,"Am nächsten Samstag findet ein jährliches Straßenfest statt.","diễn ra",1,0,wortart:verb;level:b1;thema:allgemein;voc:voc-20260522-205,1,,2026-05-22,2026-05-22,"[AI-sync 2026-05-22 | VOC-20260522-205]\n\n## Grammar / Notes\ntrennbar"
816894598,Stau,"Es gibt einen kilometerlangen Stau auf der A7 in Richtung Süden.","vụ kẹt xe",1,0,level:b1;wortart:substantiv;thema:verkehr;voc:voc-20260522-195,0,,2026-05-22,2026-05-22,
816894604,steigen,"Die Temperaturen im Norden steigen auf 20 bis 25 Grad.","tăng, lên cao",1,0,wortart:verb;level:b1;thema:wetter;voc:voc-20260522-1070,2,,2026-05-22,2026-05-22,"[AI-sync 2026-05-22 | VOC-20260522-1070]\n\n## Grammar / Notes\nbất quy tắc, đi với sein"
816894607,steigend,"Steigende Temperaturen am Wochenende.","đang tăng",1,0,level:b1;wortart:adjektiv;thema:wetter;voc:voc-20260522-874,0,,2026-05-22,2026-05-22,
816894613,Stichtag,"Der 30. November ist der Stichtag für die Kündigung.","ngày chốt hạn",1,0,level:b1;wortart:substantiv;thema:behörde;voc:voc-20260522-838,0,,2026-05-22,2026-05-22,
816894616,Stockwerk,"Sie wollen zu den oberen Stockwerken.","tầng (nhà)",1,0,level:b1;wortart:substantiv;thema:wohnen;voc:voc-20260522-982,0,,2026-05-22,2026-05-22,
816894621,Straßenbahn,"Eine verkehrsärmere Stadt braucht mehr Straßenbahnen.","tàu điện (trong thành phố)",1,0,level:b1;wortart:substantiv;thema:verkehr;voc:voc-20260522-021,0,,2026-05-22,2026-05-22,
816894628,Straßenfest,"Am nächsten Samstag findet in dem Viertel ein jährliches Straßenfest statt.","lễ hội đường phố",1,0,level:b1;wortart:substantiv;thema:freizeit;voc:voc-20260522-202,0,,2026-05-22,2026-05-22,
816894633,Streik,"Der Streik ist erst ab Montag geplant.","cuộc đình công",1,0,level:b1;thema:arbeit;wortart:substantiv;voc:voc-20260522-158,0,,2026-05-22,2026-05-22,
816894639,Stressbewältigung,"Der Podcast handelt von Methoden zur Stressbewältigung.","việc vượt qua stress",1,0,level:b1;wortart:substantiv;thema:gesundheit;voc:voc-20260522-822,0,,2026-05-22,2026-05-22,
816894644,Stromausfall,"Die Notfallsituation hat mit einem Stromausfall zu tun.","sự cố mất điện",1,0,level:b1;wortart:substantiv;thema:allgemein;voc:voc-20260522-173,0,,2026-05-22,2026-05-22,"[AI-sync 2026-05-22 | VOC-20260522-173]\n\n## Grammar / Notes\nPlural mit Umlaut"
816894651,Stromunterbrechung,"Die Operationen werden wegen einer Stromunterbrechung verschoben.","sự cúp điện",1,0,level:b1;wortart:substantiv;thema:gesundheit;voc:voc-20260522-172,0,,2026-05-22,2026-05-22,
816894656,Städtetour,"DreamTravel bietet nicht nur Städtetouren.","tour thành phố",1,0,level:b1;wortart:substantiv;thema:reisen;voc:voc-20260522-180,0,,2026-05-22,2026-05-22,
816894663,stöbern,"Am Samstag können Sie bis 20 Uhr stöbern.","lục lọi, lướt xem",1,0,wortart:verb;level:b1;thema:freizeit;voc:voc-20260522-070,0,,2026-05-22,2026-05-22,
816894671,stören,"Stören Sie die Arbeit der Feuerwehr nicht.","làm phiền / cản trở",1,0,wortart:verb;level:b1;thema:allgemein;voc:voc-20260522-861,1,,2026-05-22,2026-05-22,"[AI-sync 2026-05-22 | VOC-20260522-861]\n\n## Collocations\n- etwas als störend empfinden (cảm thấy ... gây phiền)"
816894679,störend,"Viele empfinden den Geräuschpegel als störend.","gây phiền, làm rối",1,0,level:b1;wortart:adjektiv;thema:allgemein;voc:voc-20260522-027,0,,2026-05-22,2026-05-22,"[AI-sync 2026-05-22 | VOC-20260522-027]\n\n## Collocations\n- etwas als störend empfinden (cảm thấy ... gây phiền)"
816894685,stündlich,"Die Busse fahren jetzt stündlich.","mỗi giờ một lần",1,0,level:b1;thema:verkehr;wortart:adverb;voc:voc-20260522-427,0,,2026-05-22,2026-05-22,
816894695,suchen,"Herr Müller wird von der Polizei gesucht.","tìm kiếm",1,0,wortart:verb;level:b1;thema:behörde;voc:voc-20260522-881,3,,2026-05-22,2026-05-22,
816894702,Tarif,"Die Taste 1 ist für Tarife gedacht.","giá cước, gói cước",1,0,level:b1;wortart:substantiv;thema:technologie;voc:voc-20260522-503,0,,2026-05-22,2026-05-22,
816894710,Taste,"Die Taste 4 für dringende Notfälle drücken.","phím, nút bấm",1,0,level:b1;wortart:substantiv;thema:technologie;voc:voc-20260522-459,0,,2026-05-22,2026-05-22,
816894718,technisch,"Ein technisches Problem verzögert den Zug.","thuộc kỹ thuật",1,0,level:b1;wortart:adjektiv;thema:technologie;voc:voc-20260522-716,1,,2026-05-22,2026-05-22,
816894722,teilnehmen,"Wenn Sie an einem unserer Sprachkurse teilnehmen möchten…","tham gia",1,0,wortart:verb;level:b1;thema:bildung;voc:voc-20260522-055,1,,2026-05-22,2026-05-22,"[AI-sync 2026-05-22 | VOC-20260522-055]\n\n## Grammar / Notes\ntrennbar; teilnehmen an + Dat."
816894730,telefonisch,"Das Büro wird sich telefonisch melden.","qua điện thoại",1,0,level:b1;thema:alltag;wortart:adverb;voc:voc-20260522-401,0,,2026-05-22,2026-05-22,
816894740,Temperatur,"Die Temperaturen steigen auf 20 bis 25 Grad.","nhiệt độ",1,0,level:b1;wortart:substantiv;thema:wetter;voc:voc-20260522-854,1,,2026-05-22,2026-05-22,
816894745,Temperaturabfall,"Die Kaltfront wird zu einem starken Temperaturabfall führen.","sự giảm nhiệt độ",1,0,level:b1;wortart:substantiv;thema:wetter;voc:voc-20260522-061,0,,2026-05-22,2026-05-22,"[AI-sync 2026-05-22 | VOC-20260522-061]\n\n## Grammar / Notes\nPlural mit Umlaut"
816894752,Temperaturanstieg,"Das Wochenende bringt einen Temperaturanstieg mit sich.","sự tăng nhiệt độ",1,0,level:b1;wortart:substantiv;thema:wetter;voc:voc-20260522-062,0,,2026-05-22,2026-05-22,
816894760,Termin,"Ihr Termin morgen wurde auf übermorgen verschoben.","cuộc hẹn",1,0,level:b1;wortart:substantiv;thema:gesundheit;voc:voc-20260522-111,1,,2026-05-22,2026-05-22,
816894767,Terminänderung,"Benachrichtigung zur Terminänderung.","việc thay đổi lịch hẹn",1,0,level:b1;wortart:substantiv;thema:alltag;voc:voc-20260522-579,0,,2026-05-22,2026-05-22,
816894774,Terrasse,"Die Terrasse ist geschlossen.","sân thượng / hiên",1,0,level:b1;wortart:substantiv;thema:wohnen;voc:voc-20260522-983,0,,2026-05-22,2026-05-22,
816894782,thematisieren,"Im Podcast wird Bewegung nicht thematisiert.","đưa ra làm chủ đề",1,0,wortart:verb;level:b1;thema:gesellschaft;voc:voc-20260522-824,0,,2026-05-22,2026-05-22,
816894788,Tiefkühlprodukt,"Die Abteilung für Tiefkühlprodukte befindet sich vorübergehend im Bereich neben den Kassen.","sản phẩm đông lạnh",1,0,level:b1;wortart:substantiv;thema:einkauf;voc:voc-20260522-084,0,,2026-05-22,2026-05-22,
816894796,Toilette,"Die Toiletten im Stadtpark sind geschlossen.","nhà vệ sinh",1,0,level:b1;wortart:substantiv;thema:alltag;voc:voc-20260522-968,1,,2026-05-22,2026-05-22,
816894802,Trainer,"Es wird auf die kompetenten Trainer hingewiesen.","huấn luyện viên",1,0,level:b1;wortart:substantiv;thema:gesundheit;voc:voc-20260522-201,1,,2026-05-22,2026-05-22,
816894815,Treffen,"Der Termin für das Treffen hat sich geändert.","cuộc gặp gỡ",1,0,level:b1;wortart:substantiv;thema:familie;voc:voc-20260522-186,3,,2026-05-22,2026-05-22,
816894821,Treppe,"Bitte nutzen Sie vorübergehend die Treppen.","cầu thang",1,0,level:b1;wortart:substantiv;thema:wohnen;voc:voc-20260522-431,2,,2026-05-22,2026-05-22,
816894829,trocken,"Im Osten bleibt es trocken.","khô ráo",1,0,level:b1;wortart:adjektiv;thema:wetter;voc:voc-20260522-855,2,,2026-05-22,2026-05-22,
816894837,Tropfen,"Nehmen Sie mittags und abends jeweils 10 Tropfen mit Wasser ein.","giọt (thuốc)",1,0,level:b1;wortart:substantiv;thema:gesundheit;voc:voc-20260522-811,1,,2026-05-22,2026-05-22,
816894841,täglich,"Das Medikament wird zweimal täglich eingenommen.","hàng ngày",1,0,level:b1;wortart:adjektiv;thema:gesundheit;voc:voc-20260522-812,2,,2026-05-22,2026-05-22,
816894849,Tätigkeit,"Nichts wird über eine Tätigkeit als Fußballspieler gesagt.","công việc, hoạt động",1,0,level:b1;thema:arbeit;wortart:substantiv;voc:voc-20260522-557,2,,2026-05-22,2026-05-22,
816894852,U-Bahn,"Mit der U-Bahn fahren.","tàu điện ngầm",1,0,level:b1;wortart:substantiv;thema:verkehr;voc:voc-20260522-521,0,,2026-05-22,2026-05-22,
816894859,Umbauarbeit,"Aufgrund von Umbauarbeiten ist die Abteilung eingeschränkt zugänglich.","công việc cải tạo, sửa chữa",1,0,level:b1;wortart:substantiv;thema:einkauf;voc:voc-20260522-083,0,,2026-05-22,2026-05-22,"[AI-sync 2026-05-22 | VOC-20260522-083]\n\n## Grammar / Notes\nthường dùng số nhiều"
816894868,Umbauarbeiten,"Das Bürgerbüro ist wegen Umbauarbeiten geschlossen.","công trình cải tạo",1,0,level:b1;wortart:substantiv;thema:wohnen;voc:voc-20260522-584,0,,2026-05-22,2026-05-22,
816894873,umleiten,"Der Zug wurde auf Gleis 9 umgeleitet.","chuyển hướng",1,0,wortart:verb;level:b1;thema:verkehr;voc:voc-20260522-120,0,,2026-05-22,2026-05-22,"[AI-sync 2026-05-22 | VOC-20260522-120]\n\n## Grammar / Notes\ntrennbar"
816894878,Umleitung,"Es gibt eine Umleitung wegen der Bauarbeiten.","đường vòng / lộ trình thay thế",1,0,level:b1;wortart:substantiv;thema:verkehr;voc:voc-20260522-906,0,,2026-05-22,2026-05-22,
816894882,umschlagen,"Das Wetter schlägt schnell um.","đột ngột chuyển biến, đổi chiều",1,0,wortart:verb;level:b1;thema:wetter;voc:voc-20260522-768,0,,2026-05-22,2026-05-22,"[AI-sync 2026-05-22 | VOC-20260522-768]\n\n## Grammar / Notes\ntách được"
816894890,umsteigen,"Fahrgäste, die in die Innenstadt möchten, sollen in einen Bus umsteigen.","đổi chuyến (xe/tàu)",1,0,wortart:verb;level:b1;thema:verkehr;voc:voc-20260522-129,0,,2026-05-22,2026-05-22,"[AI-sync 2026-05-22 | VOC-20260522-129]\n\n## Grammar / Notes\ntrennbar"
816894898,umstellen,"Sie können Ihre Kfz-Versicherung für das folgende Jahr umstellen.","chuyển đổi",1,0,wortart:verb;level:b1;thema:behörde;voc:voc-20260522-839,0,,2026-05-22,2026-05-22,
816894906,umtauschen,"Die Frau möchte das Kleid nicht umtauschen.","đổi hàng",1,0,wortart:verb;level:b1;thema:einkauf;voc:voc-20260522-1115,0,,2026-05-22,2026-05-22,"[AI-sync 2026-05-22 | VOC-20260522-1115]\n\n## Grammar / Notes\ntrennbar"
816894913,Umweltverschmutzung,"Umweltverschmutzung ist in großen Städten ein Problem.","ô nhiễm môi trường",1,0,level:b1;wortart:substantiv;thema:gesellschaft;voc:voc-20260522-829,0,,2026-05-22,2026-05-22,
816894919,Umzug,"Mirko fragt, ob du ihm beim Umzug helfen kannst.","việc chuyển nhà",1,0,level:b1;wortart:substantiv;thema:wohnen;voc:voc-20260522-121,0,,2026-05-22,2026-05-22,"[AI-sync 2026-05-22 | VOC-20260522-121]\n\n## Grammar / Notes\nPlural mit Umlaut"
816894925,Unannehmlichkeit,"Mögliche Unannehmlichkeiten sollen vermieden werden.","sự bất tiện",1,0,level:b1;wortart:substantiv;thema:allgemein;voc:voc-20260522-989,0,,2026-05-22,2026-05-22,
816894929,unerwartet,"Der Flug wurde aufgrund unerwarteter Wetterbedingungen verschoben.","không lường trước, bất ngờ",1,0,level:b1;wortart:adjektiv;thema:allgemein;voc:voc-20260522-176,1,,2026-05-22,2026-05-22,
816894938,Unfall,"Der Stau ist wegen eines Unfalls entstanden.","tai nạn",1,0,level:b1;wortart:substantiv;thema:verkehr;voc:voc-20260522-196,2,,2026-05-22,2026-05-22,"[AI-sync 2026-05-22 | VOC-20260522-196]\n\n## Grammar / Notes\nPlural mit Umlaut"
816894947,unpersönlich,"Große Städte wirken oft unpersönlich.","vô danh, không thân mật",1,0,level:b1;wortart:adjektiv;thema:wohnen;voc:voc-20260522-026,0,,2026-05-22,2026-05-22,
816894956,Unterbrechung,"Für die Dauer der Unterbrechung werden Busse eingesetzt.","sự gián đoạn",1,0,level:b1;wortart:substantiv;thema:verkehr;voc:voc-20260522-419,0,,2026-05-22,2026-05-22,
816894967,unterbrochen,"Die Zugverbindung ist aufgrund von Wartungsarbeiten unterbrochen.","bị gián đoạn",1,0,level:b1;wortart:adjektiv;thema:verkehr;voc:voc-20260522-045,1,,2026-05-22,2026-05-22,"[AI-sync 2026-05-22 | VOC-20260522-045]\n\n## Grammar / Notes\nPartizip II von unterbrechen"
816894976,Untersuchung,"Die Untersuchung beim Hausarzt durchführen lassen.","việc khám bệnh",1,0,level:b1;wortart:substantiv;thema:gesundheit;voc:voc-20260522-498,2,,2026-05-22,2026-05-22,
816894983,unvergesslich,"DreamTravel wird als Anbieter von unvergesslichen Urlaubserlebnissen vorgestellt.","không thể quên",1,0,level:b1;wortart:adjektiv;thema:reisen;voc:voc-20260522-181,0,,2026-05-22,2026-05-22,
816894991,Urlaub,"Eine Woche Urlaub in Paris für zwei Personen.","kỳ nghỉ",1,0,level:b1;wortart:substantiv;thema:reisen;voc:voc-20260522-885,2,,2026-05-22,2026-05-22,
816894997,Urlaubserlebnis,"DreamTravel bietet verschiedene Urlaubserlebnisse weltweit.","trải nghiệm du lịch",1,0,level:b1;wortart:substantiv;thema:reisen;voc:voc-20260522-178,0,,2026-05-22,2026-05-22,
816895003,ursprünglich,"Der Sonntag war ursprünglich geplant.","ban đầu, gốc",1,0,level:b1;wortart:adjektiv;thema:allgemein;voc:voc-20260522-436,2,,2026-05-22,2026-05-22,
816895011,veraltet,"Der alte Fahrplan ist veraltet.","lỗi thời / cũ kỹ",1,0,level:b1;wortart:adjektiv;thema:allgemein;voc:voc-20260522-955,0,,2026-05-22,2026-05-22,
816895022,Veranstaltungskalender,"Sie sind mit unserem Veranstaltungskalender verbunden.","lịch sự kiện",1,0,level:b1;wortart:substantiv;thema:freizeit;voc:voc-20260522-064,0,,2026-05-22,2026-05-22,
816895028,verdächtig,"Bei verdächtigen Anrufen rufen Sie 133 an.","khả nghi, đáng ngờ",1,0,level:b1;wortart:adjektiv;thema:gesellschaft;voc:voc-20260522-629,0,,2026-05-22,2026-05-22,
816895035,vereinbaren,"Vereinbaren Sie einen Beratungstermin.","thỏa thuận, hẹn",1,0,wortart:verb;level:b1;thema:allgemein;voc:voc-20260522-146,0,,2026-05-22,2026-05-22,
816895046,vereinzelt,"Am Mittwoch kann es zu vereinzelten Regenschauern kommen.","lẻ tẻ, rải rác",1,0,level:b1;wortart:adjektiv;thema:wetter;voc:voc-20260522-1032,1,,2026-05-22,2026-05-22,
